标题,总价,单价,区域,房屋户型,建筑面积,户型结构,建筑类型,所在楼层,楼层高度,套内面积,房屋朝向,建筑结构,装修情况,户梯比例,配备电梯,周边配套,交通出行
户型方正~、适合单身居住~、采光通风好,100,23652,白云,1室1厅1卫,42.28㎡,平层,塔楼,高楼层(共9层),暂无数据,暂无,南,钢混结构,其他,,,商城有新都汇购物广场、利广场、凯升广场、骏盈广场等~、距离同德国商圈1公里的悦汇城大型购物广场~、属于广州西部前一、广州第二大的单体购物商城。公园有同德公园、聚龙公园、石井河绿道等可供居民日常健身休闲的地方。,地铁八号线同德地铁站~、同德乡公交车站是广州交通网络重要站点之一~、经过同德乡的线路有729A路环线~、夜80路~、134路~、175路~、176路~、179路~、17路~、17路短线~、196路~、212路~、215路~、215路长线~、228路~、238路~、241路~、524路~、527路~、539路~、543路~、545路。
G区单边位~、南向四房三卫~、安静园景,580,45916,白云,4室2厅3卫,126.32㎡,平层,塔楼,低楼层(共18层),暂无数据,105.48㎡,南,钢混结构,其他,,有,该小区配套成熟~、包括有大型购物商场-云门PARK~、该商场有各类品牌餐饮店和服装店。有四大银行和足够街市~、星巴克等大型配套~、能够满足您日常的生活所需,地铁三线交汇2~、3~、14号线嘉禾站~、3号线白云大道北站公交线路：667路；126路701路804路832路833路862路864路
时代玫瑰园南向大三房   户型方正   安静望花园,420,33871,白云,3室2厅2卫,124㎡,平层,塔楼,低楼层(共18层),暂无数据,暂无,南,钢混结构,简装,,有,小区出门口200米内就有华润市、西亚兴安市、大森林药店、生鲜市、养发馆、农业银行。中国银行。建设银行、工商银行、7-11、全家便利店~、生活方便。2.广州设计之都红点广场（肩比高德置地广场）、两公里内有安华汇、金铂广场等购物广场~、南方医白云分院。,小区位于2号线黄边地铁站上盖~、下楼即地铁~、还有多条公交站：38、58、798、831、794路等等~、1公里内6个高速口后期还有14号线二期地铁经过~、交通便捷
云苑新村~、东南向~、厅出阳台、平层电梯,160,25853,白云,2室1厅1卫,61.89㎡,平层,塔楼,高楼层(共9层),暂无数据,暂无,东南,钢混结构,其他,,有,云苑白云市场~、云苑市场~、柯子岭肉菜市场~、医院中医学院附属医院~、十二人民医院社区医院~、商场沃尔玛广场五号停机坪,地铁：2号线飞翔公园站~、11和12号线在建~、预计2022年年底开通。公交：186、284、479、921、124、182总站。还有175、179、181、189、199、210、241、24、257、265、273、278、298、32、38、46、540、60、63、810、34等公交。
产权清晰~、户型通透~、中间楼层采光好,106,16343,白云,2室1厅1卫,64.86㎡,平层,塔楼,中楼层(共9层),暂无数据,暂无,南,钢混结构,其他,,,小区配套成熟银行中国银行工商银行农业银行光大银行建设银行医院白云区人民医院中兴运动损伤医院新市医院商场新市综合商圈东区以及西区凯德广场五号停机坪广场儿童体育公园,公交车站步行一公里可到达~、享有地铁2号线三元里以及白云公园、飞翔公园~、市政道路建有自行车车道~、可绿色出行~、驾车便利~、沿线的三元里大道为双向六车道市政路~、机场路为双向八车道市政路~、可前往广州六大区以及机场高速~、华南快速~、北二环等等。
越秀区北站路 小区电梯一房一厅,56,32037,白云,1室1厅1卫,17.48㎡,平层,塔楼,中楼层(共9层),暂无数据,暂无,西北,钢混结构,精装,,有,医院银行菜市场商场三元里地铁站北站路/沙涌北公交车站多条线路选择出,
东南向3房2卫 高层 视野好  户型方正,420,41613,白云,3室2厅2卫,100.93㎡,平层,塔楼,中楼层(共32层),暂无数据,暂无,东南,钢混结构,精装,,有,,小区距离3号线地铁同和站1.5公里~、小区门口有公交车可直达地铁口~、距离华南快速同和收费站仅600米左右~、出行便利
山水庭苑~、241方一线湖景~、装修好~、即买即入住,1000,41470,白云,5室2厅3卫,241.14㎡,平层,塔楼,中楼层(共16层),暂无数据,暂无,西北,钢混结构,精装,,有,,
保利春天里两房 采光好 交通方便 成熟小区,183,23650,白云,2室1厅1卫,77.38㎡,平层,塔楼,中楼层(共11层),暂无数据,63.4㎡,北,钢混结构,精装,,有,保利春天里地处地铁六号线总站浔峰岗站~、配有民生银行、华润.家、大型便民市场~、永旺梦乐城~、星巴克~、肯德基~、工商银行等等,位于地铁6号线浔峰岗站旁~、交通便利~、公交：830路16路夜线高峰快线25高峰快线9276路、12路、42路、55路、283路、424路、290路、885路、高峰30路、231快线、里07路、佛231路等
市园林小区 白云新城地段 近白云体育馆 电梯中层 南向,170,32624,白云,2室1厅1卫,52.11㎡,平层,塔楼,中楼层(共9层),暂无数据,45.62㎡,东南,钢混结构,精装,,有,钱大妈~、胜佳~、顺丰速运~、社区便民~、凯德广场~、5号停机坪~、儿童乐园~、白云金街~、无限级广场等~、白云新城商圈~、商圈成熟~、生活便利,金信路站:34、544、547、795、841、757、921、223、245、265、864、B18、夜52路。云城东路南站：664、795、980、981、982、夜75、地铁2号线：白云公园站100米~、距离在建的12号线小金钟地铁站500米
南湖半岛花园 3室2厅 西 北,387,27949,白云,3室2厅2卫,138.47㎡,平层,塔楼,低楼层(共18层),暂无数据,115.13㎡,西北,钢混结构,精装,,有,,
云景名都  南向三房 满五唯一,460,48657,白云,3室2厅1卫,94.54㎡,平层,塔楼,低楼层(共23层),暂无数据,暂无,东南,钢混结构,其他,,有,菜市场、商场、公交站、地铁、银行、医院等配套都完善~、成熟。银行：工行、建行、中行等；医院：一五七医院~、南方医院~、京溪社区医院等；商场：乐购、广白白货、摩登白货、太阳城广场等。,公交：云景花园西门总站~、南方医院站~、京溪路站~、云景花园站~、B6路、B6路快线、126路、179路、296路、32路、502路、504路、804路、832路等公交路。地铁：京溪南方医院地铁站约400米。
峯境精装修两房 户型方正 业主诚意放盘 视野开阔,390,50401,白云,2室2厅1卫,77.38㎡,平层,塔楼,高楼层(共17层),暂无数据,暂无,西南西,钢混结构,其他,,有,环境优越~、东靠白云山风景区~、南靠成熟的广园新村~、于白云新城咫尺之间~、地段好~、天赋地段~、市政府重金打造~、绿地央企集团~、新体育馆~、白云儿童公园~、云溪生态公园只需1公里左右。,小区门口有公交站台~、去到越秀天河荔湾花都都有多路公交经过~、交通出行方便~、地铁飞翔公园1500米~、高德地图已经显示规划地铁12号线小金钟站~、距离小区仅100米左右~、即将通车。
云苑新村 中层步梯两房 格局方正 精装修,145,22835,白云,2室1厅1卫,63.5㎡,平层,塔楼,中楼层(共9层),暂无数据,暂无,东西,钢混结构,精装,,,有柯子岭白云菜市场云苑菜市场白云市场步行街人人佳商场等公园三泰公园白云儿童公园白云山云溪生态公园体育馆雕塑公园云台花园,地铁：2号线飞翔公园站；11号线~、24年年底开通；12号线~、25年开通。公交：186、284、479、921、124、182总站还有175、179、181、189、199、210、241、24、257、265、273、278、298、32、38、46、540、60、63、810、34等公交
设计之都都市品格 大两房户型实用 业主有心放卖可以谈,217,24473,白云,2室1厅1卫,88.67㎡,平层,塔楼,中楼层(共13层),暂无数据,65.61㎡,东北,钢混结构,精装,,有,地铁14号线二期700米、公交车等可以经过小区；医院有市第八人民医院嘉禾院区在小区旁~、是有保障的医院；星汇广场、YH城、集贤购物广场、马务尚佳广场都在旁；鹤灵公园、鹤鸣公园就在小区旁~、适合休闲活动,交通便利~、距离江夏地铁1709米~、目前地铁14号线二期地铁站就在楼下年底通车200米左右离小区285米有省解毒基地站251、259、274、425、510等线路公交车都可以到
乐嘉路 电梯2房 交通便利 成熟社区配套 随时看房,135,23557,白云,2室1厅1卫,57.31㎡,平层,塔楼,低楼层(共9层),暂无数据,暂无,东南西,钢混结构,其他,,有,：区位于机场路以西~、此地段经过了二十多年的发展已经feichang成熟了~、小区离最近的菜市场350米~、zhoubian多家钱大妈以及水果店~、逛街可去到达广场（1.5公里）五号停机坪（2公里）凯德广场（2.5公里）等等~、远景路还有吃货韩国街（烤肉,飞翔公园地铁站离小区大概650米~、后期有地铁14号线二期乐嘉路站~、规划站点离小区250米~、这条线是越秀火车站到嘉禾望岗的。楼下有公交站（32、58、58A、63、741、夜105）去到越秀天河海珠都比较方便
三房户型方正~、配套齐全~、交通方便~、生活便利,381,34993,白云,3室1厅2卫,108.88㎡,平层,塔楼,中楼层(共17层),暂无数据,暂无,南北,钢混结构,其他,,有,该小区配套成熟~、生活方便。小区1号门出来是大型购物商场~、云门PARK~、云里~、云悦。小区内也有钱大妈~、出口商业街有银行等~、能够满足您日常的生活所需,交通方便一公里内有嘉禾望岗地铁站~、广州大道北地铁站~、公交车总站~、线路包括804路、886路、805路、799路、920路、922路、924路、926路、509路、66..
富力城北区 高层大两房 视野开阔 满五唯一,178,20665,白云,2室2厅1卫,86.14㎡,平层,塔楼,高楼层(共17层),暂无数据,暂无,东南,钢混结构,简装,,有,广州富力城商城：ATM:中国邮政储蓄银行~、建设银行~、交通银行~、广州农商银行内部配套：足球场~、篮球场~、网球场~、高尔夫练习场~、游乐场~、风情街~、会所~、洗衣店~、户外露天游泳池~、幼儿园,公交：511路、523路、539路、834路、840路、21路、127路、978路~、地铁：2号线嘉禾望岗站、3号线嘉禾望岗站
白云区飞鹅西路小区标准两房一厅,130,20059,白云,2室1厅1卫,64.81㎡,平层,塔楼,高楼层(共9层),暂无数据,暂无,南,钢混结构,其他,,,广源文化广场~、离小区大概900米。有达三甲标准的广州中医药大学附属医院~、离小区大概400米。广州市三元里抗英斗争纪念公园、广州雕塑公园、榕荫园等~、离的最近的是广州市三元里抗英斗争纪念公园~、大概500米的距离。,
中高层（非顶）70年产权商品房 可商贷可公积金,88,17646,白云,2室1厅1卫,49.87㎡,平层,塔楼,高楼层(共33层),暂无数据,36.61㎡,西,钢混结构,其他,,有,商场悦和方~、就在200米的距离~、里面的商场~、电影院~、大大小小的品牌店一应俱全。,公交：龙归永兴村总站交通线路图~、途经线路包括途76A、529路、563路、659路、833路、972路、夜76路、夜86路。龙归城站：427路、656路、659路、夜119路、793路地铁：地铁3号线延长线龙归站~、距其直线距离800米。地铁14号线夏良站D口~、距其直线距离100米。
星海花园 满五年 配套设施齐全 交通便利,339,34592,白云,3室1厅1卫,98㎡,平层,塔楼,低楼层(共11层),暂无数据,85.5㎡,西北,钢混结构,其他,,有,商场：广货、华润家、永旺梦乐城~、沙田广场~、永润广场~、金铂广场；公园：浔峰山森林公园、白云儿童公园；医院：金沙洲首家三甲-广州中医药大学附属医院~、横沙社区医院。银行：农业银行~、民生银行,在建地铁12号线里横路站离小区约800米~、小区楼下有便民车与658公交车~、都可到浔峰岗地铁站~、江边也有公交车站~、彩滨北路站~、290、55、12、276、283、885、429、830、42等16条公交线路。
标题,总价,单价,区域,房屋户型,建筑面积,户型结构,建筑类型,所在楼层,楼层高度,套内面积,房屋朝向,建筑结构,装修情况,户梯比例,配备电梯,周边配套,交通出行
时代玫瑰园 两房 格局好 业主诚心出,239,33278,白云,2室2厅1卫,71.82㎡,错层,塔楼,中楼层(共13层),暂无数据,暂无,西南,钢混结构,其他,,有,小区出门口200米内就有华润市西亚兴安市大森林药店生鲜市养发馆农业银行中国银行建设银行工商银行、7-11全家便利店生活方便~、广州设计之都红点广场肩比高德置地广场~、大型商场时光汇就在楼下~、吃喝玩乐都有~、两公里内有安华汇金铂广场等购物广场~、南方医院,小区位于2号线黄边地铁站上盖~、下楼即地铁~、还有多条公交站：38、58、798、831、794路等等~、1公里内6个高速口后期还有14号线二期地铁经过~、交通便捷。
云景花园 精装三房 户型方正实用  安静舒适 视野开阔,450,46507,白云,3室2厅1卫,96.76㎡,平层,塔楼,中楼层(共10层),暂无数据,85.04㎡,西,钢混结构,其他,,有,商场:嘉裕太阳城广场、佳润广场、摩登、金茂广场.金柏广场医院:南方医院、三九脑科医院、同和医院、白云山医院、邮局:梅花园邮局、同和邮局银行:工商银行、建设银行、农业银行、中国银行、农商银行、广发银行,公交途经线路：16路179路219路498241路504路560路56路701路804路833路836路862862B高峰快线48高峰快线19夜24路夜47路；地铁：三号线京溪南方医院
伟腾云星 精装修 拎包入住 南向 次新房,310,37658,白云,2室2厅1卫,82.32㎡,平层,塔楼,中楼层(共15层),暂无数据,63.83㎡,南,钢混结构,精装,,有,,小区楼下的地铁14号线鹤南站正在修~、步行200米到公交车站~、途径的公交58、831、984、667等
东南向户型~、厅出阳台~、全明房！,268,30563,白云,3室1厅1卫,87.69㎡,平层,塔楼,低楼层(共12层),暂无数据,75.47㎡,东南,钢混结构,简装,,有,小区有商场~、邮局~、银行(建设银行、工商银行、邮政储蓄等)出小区500米范围内：妇产玛莱医院~、有松洲菜肉市场~、购物买菜方便;有肯德基、美容院等,位置好~、出行便利~、四通八达~、小区门口有20几路公交车去到各个区域~、未来规划：小区正门口左手边十三号线二期工程罗冲围站地铁口竣工就在眼前~、后期交通选择很多~、让您的更加快捷便利dong'nan'xiang
白云山下大三房带平台视野采光好,300,25467,白云,3室2厅2卫,117.8㎡,平层,塔楼,低楼层(共12层),暂无数据,100㎡,西南,钢混结构,其他,,有,小区内部配套包括:幼儿园、游泳池、网球场、桌球、乒乓球室、艺术长廊等各类娱乐休闲配套设施。项目内拥有6000平方米尊尚会所~、会所分为三层~、有室外游泳池、网球场、篮球场、桑拿室;中西餐厅、咖啡厅;阅览室;桌球、乒乓球室。,小区门口就是广从路~、进出便利。另外路口就是永泰汽车客运站~、搭公交很便利。区门口有公交~、一站到地铁14号线东平站
白云站旁南航新村高层电梯三房两卫,210,20506,白云,3室2厅2卫,102.41㎡,平层,塔楼,高楼层(共17层),暂无数据,90.28㎡,东北,钢混结构,其他,,有,,
卖点：此房环境安静~、楼龄新~、生活便利~、新装修,225,41384,白云,1室1厅1卫,54.37㎡,平层,板楼,高楼层(共10层),暂无数据,暂无,西南西,钢混结构,精装,,有,配套：市场、商场、公交站、银行、医院、幼儿园等都完善~、成熟。一五七医院~、南方医院~、京溪社区医院等；,交通出行：地铁站：3号线北延线同和站C出口公交：16路、B6路快线、56路、179路、241路、504路、502路、804路、136路、219路、862路、832路、126路、136路、836路、83路、701路、560路、833
精装两房  中高楼层  满五唯一  近地铁,320,36614,白云,2室2厅1卫,87.4㎡,平层,塔楼,中楼层(共30层),暂无数据,70.04㎡,北,钢混结构,其他,,有,有chao市、711便利店、OK便利店~、美容院、美发店、面包店；会所(羽毛球场、乒乓球场、大型足交通球场地、篮球场地)等生活配套设施完善！还有新开业云门商场~、商场内有电影院~、东海酒家~、盒马生鲜等。,一公里内有地铁站和广州大道北地铁站~、地铁线路：14号地铁线~、2号地铁线~、3号地铁线。公交车总站线路包括804路、886路、805路、799路、920路、922路、924路、926路、509路、66路、803路等数十几条公交路线。
乐嘉路 乐嘉花园小区 步梯中层 精装3房 户型方正,148,19281,白云,3室1厅1卫,76.76㎡,平层,塔楼,中楼层(共7层),暂无数据,暂无,南,钢混结构,精装,,,公园有街消防主题公园儿童公园消费娱乐距离1.5公里有广场距离3公里有5号停机坪购物消费~、小区方园500米有中国银行~、农业银行等等。,小区现有地铁二号线飞翔公园站~、步行700米左右~、另外预计2025年年底开通14号线二期。
天河一路之隔 白云区刚需上车小两房,180,28522,白云,2室1厅1卫,63.11㎡,平层,塔楼,中楼层(共9层),暂无数据,56.02㎡,南,钢混结构,精装,,,小区楼栋旁边150米内有肉菜市场~、生活市场。2公里内三家三甲医院~、有157医院~、南方医院~、三九脑科医院~、医疗资源完善。步行800米可以达到梅花园广场~、佳润广场~、吃饭~、购物~、看电影等一应俱全。,双地铁楼盘~、分别是梅花园3号线及18号线京溪路站5个站到珠江新城。距离500米左右有梅花园新村公交站~、可直达白云东~、天河北~、珠江新城
政通路 马赛克外墙 电梯平层 高层三房 单边位,390,35840,白云,3室2厅1卫,108.82㎡,平层,塔楼,高楼层(共10层),暂无数据,暂无,东西,钢混结构,精装,,有,,政通路有公交：175、179、181、189、199、241、24、257、265、273、278、298、32路公交车。
望江 视野开阔 户型使用率高 满五唯一,350,35869,白云,3室1厅2卫,97.58㎡,平层,塔楼,高楼层(共18层),暂无数据,暂无,东北,钢混结构,其他,,有,医院：广州中医药大学金沙洲医院、银行：工商银行、中国银行、农业银行、农商银行、中国邮政储蓄银行：佳和购物广场、钱大妈、卜蜂莲花市场：沙凤综合市场、金沙洲便民综合街市公园：白云儿童公园、金沙洲文体广场、金沙洲。,沙贝地铁6号线A出口~、42路公交车~、地铁六号线沙贝站~、是您居家之地~、交通方便。
白云山下 阳台望公园  空气环境好 户型格局方正,195,21164,白云,3室1厅1卫,92.14㎡,平层,塔楼,低楼层(共9层),暂无数据,80.13㎡,东南,钢混结构,其他,,有,从小区到陈田花园200米~、悠闲游玩的好去处~、到购物商场安华汇300米~、到博济医院390米~、到白云花园公交站200米。,小区位于白云大道北上~、双向6车道。地铁3号线白云大道北站；300米内有4个公交站（可至越秀、荔湾）；华南快速-永泰收费站。
新兴白云花园 商品房 无按揭 安静望小区,100,18861,白云,2室1厅1卫,53.02㎡,平层,塔楼,中楼层(共9层),暂无数据,暂无,北,钢混结构,其他,,,小区里面有泳池~、还有菜市场~、出门是解放庄~、各种小吃都有。步行800米就到了大型的综合体----安华汇~、里面有购物广场~、电影院~、美食城等；步行700米到设计之都~、有商场~、永旺Chao市~、电影院等！,小区门口就是公交总站~、可以去各个区域~、到白云大道北地铁站1000米~、到黄边地铁口750米左右
白沙小区 满五唯一 户型方正 采光效果好,90,16624,白云,2室1厅1卫,54.14㎡,平层,塔楼,高楼层(共9层),暂无数据,暂无,南,钢混结构,其他,,,该小区位于岗贝社区~、白色的马赛克外墙~、总层高9层~、保安值班管理~、小区管理严密~、闹中取静~、小区配套齐全~、住家舒适便利,
松涛南苑 小区管理 保养好 南向采光足,135,19813,白云,2室1厅1卫,68.14㎡,平层,塔楼,高楼层(共8层),暂无数据,64.58㎡,南,钢混结构,其他,,,菜市场~、外语外贸学院~、医院~、银行~、宾馆~、商铺~、酒楼~、小区外面公交车站和地铁3号线延长线~、给生活带来更多的便利！,交通出行：76、233、529、805、864、76A、126、268、539、804、夜班9路等多路公交车~、地铁3号线延长线出行方便
南向两房 格局好 户型不错 看房方便 随时可看,93,26242,白云,2室1厅1卫,35.44㎡,平层,塔楼,高楼层(共7层),暂无数据,暂无,南,钢混结构,其他,,,有人人佳商场柯子岭菜市场云苑市场白云市场步行街车站地铁飞翔公园站配套成熟小区有车位即到182、124、284、186公交总站大型商场凯德广场五号停机坪等购物广,地铁：即将建成开通双铁11号线~、12号线~、目前可乘坐2号线飞翔公园站公交：186、284、479、921、124、182总站还有175、179、181、189、199、210、241、24、257、265、273、278、298、32、38、46、540、60、63、810、34等公交客运站：广园客运站
享南医大   稀有户型   视野开阔  景观视野,199,33167,白云,2室2厅1卫,60㎡,平层,塔楼,中楼层(共9层),暂无数据,暂无,北,钢混结构,其他,,有,,
星汇云城 南向3房2卫 望花园 不靠高速,450,44710,白云,3室2厅2卫,100.65㎡,平层,塔楼,中楼层(共32层),暂无数据,暂无,南北,钢混结构,其他,,有,,距离3号线同和站1.5公里~、小区门口有公交车可直达地铁口~、距离华南快速同和收费站仅900米左右~、出行便利
深业江悦湾 高层视野宽阔 采光通风充足,300,31875,白云,3室1厅2卫,94.12㎡,平层,塔楼,高楼层(共26层),暂无数据,76㎡,西北,钢混结构,其他,,有,配套设施一应俱全~、满足您的全方位生活需求。大型购物近在咫尺~、汇聚众多品牌、餐饮美食、娱乐休闲场所~、让您一站式享受购物、餐饮、观影等乐趣。,金翠湾地理位置优越~、交通网络发达。城市主干道~、多条公交线路就在家门口~、可快速畅达城市各处。
南湖生活区高品质两房~、南向通透安静舒适,130,20672,白云,2室2厅1卫,62.89㎡,平层,板楼,中楼层(共5层),暂无数据,56.82㎡,南,混合结构,简装,,,有雄州城广场~、金铂广场~、白云山风景旅游区~、大河马水上乐园~、菜市场也是很方便,南湖生活区小区交通门口就有公交站~、离同和地铁站1公里~、开车上同泰路！
金碧雅苑 大三房 楼层高 视野开阔 采光好,328,33738,白云,3室2厅2卫,97.22㎡,平层,塔楼,中楼层(共17层),暂无数据,暂无,东南南西南,钢混结构,其他,,有,,小区位于尖彭路~、正门出去东边700米是三号线白云大道北B出口。西南门出去步行450米到二号线黄边地铁口~、坐地铁去越秀区或珠江新城交通便利~、自驾1000米上华南快速路~、有8865098044253875579892758等多路公车
视野开阔~、装修保养好~、南向~、中楼层~、采光通风好,480,50767,白云,3室2厅1卫,94.55㎡,平层,塔楼,中楼层(共23层),暂无数据,暂无,南,钢混结构,精装,,有,,
东湖映月 精致两房 诚心出 业主自住 保养好 采光好,170,24176,白云,2室1厅1卫,70.32㎡,平层,塔楼,低楼层(共33层),暂无数据,56.33㎡,北,钢混结构,其他,,有,出门就有综合市场~、培训机构~、美容院~、水果店~、理发店~、游泳池~、餐饮医院等,公交：龙归永兴村总站交通线路图~、途经线路包括途656路、652、529路、563路、701路、833路、837路。地铁：地铁3号线延长线龙归站~、距其直线距离800米。地铁14号线夏良站~、距其直线距离100米
金碧厅出阳台南向 阳光好 装修新 小区环境舒适配套齐,180,27040,白云,2室2厅1卫,66.57㎡,平层,塔楼,低楼层(共11层),暂无数据,56.39㎡,南,钢混结构,精装,,有,金碧新城生活配套：有月亮弯游泳池、罗马音乐喷泉、环型跑道、蓝球场、网球场、会所、市场、银行、好又多、啃德基、国美电器、便利店、麦当劳、美宜家、7-11便利店、石井广场、医疗门诊、等,金碧新城公交路线地铁8号线小坪站金碧新城总站:7~、63路~、小坪南站:259~、539途经石井站线路126~、254~、280~、291B~、425~、519~、524~、556~、563~、830~、831~、841乡村巴士1乡村巴士2夜26
此房满五唯一~、南向高楼层~、装修保养好~、实用率高,380,38713,白云,3室1厅2卫,98.16㎡,平层,塔楼,中楼层(共11层),暂无数据,暂无,西南,钢混结构,精装,,有,有足够街市、711便利店、OK便利店~、美容院、美发店、面包店；会所(羽毛球场、乒乓球场、大型足交通球场地、篮球场地)等生活配套设施完善！还有新开业云门商场~、商场内有电影院~、东海酒家~、盒马生鲜等,有公交76路、803路、922路、509路等线路~、地铁2号线和地铁3号线以及地铁14号线嘉禾望岗站~、交通方便
