标题,总价,单价,区域,房屋户型,建筑面积,户型结构,建筑类型,所在楼层,楼层高度,套内面积,房屋朝向,建筑结构,装修情况,户梯比例,配备电梯,周边配套,交通出行
人和龙湖天柱18号线地铁直达珠江新城36多急卖业主,390,28004,白云,4室2厅2卫,139.27㎡,平层,板塔结合,中楼层(共16层),暂无数据,暂无,南北,钢混结构,简装,,有,小区在人和18号线地铁口~、有华通商场~、菜市场~、酒店~、四大银行~、中医院白云分医院~、流溪河公园~、娱乐休闲场地华通广场白云新天地（建设中）医疗:三甲广州中医药大学附属医院白云分院,离地铁口200米~、18和22号线地铁在建设中~、26年开通~、门口有多条公交可以回市区和花都。近高速蚌湖出口~、人和出口~、双高速出口
高层南向高层两房 少有放盘房源 通风采光好,368,53065,白云,2室1厅1卫,69.35㎡,平层,塔楼,高楼层(共9层),暂无数据,暂无,东南,钢混结构,其他,,有,南方医院~、一五七医院~、三九脑科医院。商场：佳润广场~、梅花园广场~、~、金铂天地。市场：云景肉菜市场~、白灰场农贸综合市场~、钱大妈。景点：白云山风景区,公交：云景花园西门总站~、南方医院站~、京溪路站~、云景花园站~、B6路、B6路快线、126路、179路、296路、32路、502路、504路、804路、832路等公交路。地铁：京溪南方医院地铁站
岭南映悦园 高层两房 视野开阔 诚意出让,260,32331,白云,2室2厅1卫,80.42㎡,平层,塔楼,高楼层(共17层),暂无数据,64.41㎡,北,钢混结构,简装,,有,岭南是开发了20年的成熟社区~、配套齐全~、楼下的底商银行一条街~、市场、药房、食肆、还有云门商场~、吃喝玩乐都可以满足,项目板块在嘉禾望岗这边~、距离嘉禾地铁站是1.5公里左右、有电动车会更方便。门口还有便民车接驳地铁口~、楼下还有公交车站~、出行还是比较方便的
金碧雅苑 南向三房望小区园林 位置安静 保养好,315,37191,白云,3室2厅1卫,84.7㎡,平层,塔楼,低楼层(共18层),暂无数据,70.81㎡,南,钢混结构,精装,,有,银行：中国银行、工商银行、农业银行、建设银行医院：中山愽济医院、南方医院商场：安华汇、白云汇、云门小区门口有农贸市场、美宜佳、美容院、美发店、钱大妈等,双地铁小区~、2号线300多米到达~、3号线600多米到达。小区外医院、公园、教学、娱乐、商城等设施保持在两公里范围内且数量密集~、是一个很稳定的商圈。小区出门便是云山新天地综合体~、生鲜、音乐餐吧、烧烤等
此房为电梯四房户型方正 采光好 干净整洁,498,39023,白云,4室2厅2卫,127.62㎡,平层,塔楼,高楼层(共34层),暂无数据,暂无,南,钢混结构,精装,,有,,公交线路有：198A、428、17、228、521、563。在建地铁12号线槎头站~、距离约1.2公里
标题,总价,单价,区域,房屋户型,建筑面积,户型结构,建筑类型,所在楼层,楼层高度,套内面积,房屋朝向,建筑结构,装修情况,户梯比例,配备电梯,周边配套,交通出行
龙归城两房~、采光好~、近地铁~、中高楼层,158,21022,白云,2室1厅1卫,75.16㎡,平层,塔楼,中楼层(共33层),暂无数据,暂无,北,钢混结构,其他,,有,楼下悦和方商场200米的距离~、里面的商场~、电影院海底捞~、麦当劳星巴克具备了社区医院,公交：龙归总站交通线路图~、途经线路包括途76A、529路、563路、659路、833路、972路、夜76路、夜86路。龙归城站：427路、656路、659路、夜119路、793路地铁14号线夏良站D口~、距其直线距离200米
春鸿居 商品房  安静 望花园  厅出阳台 格局好,142,22804,白云,2室1厅1卫,62.27㎡,平层,塔楼,低楼层(共9层),暂无数据,暂无,东,钢混结构,其他,,,从小区到陈田花园200米~、悠闲游玩的好去处~、到购物商场安华汇300米~、~、到白云花园公交站200米！,小区位于白云大道北上~、双向6车道~、地铁3号线白云大道北站1000米；300米内有4个公交站（可至越秀、荔湾）；华南快速-永泰收费站！
准电梯动工 满五年 户型方正采光好 近地铁封闭式管理,170,23964,白云,2室1厅1卫,70.94㎡,平层,塔楼,高楼层(共9层),暂无数据,暂无,西南,钢混结构,精装,,有,泽德花园配套：中国银行~、工商银行~、白云区中医院~、酒楼~、骏荣广场食街~、同德上步广场~、家私城~、菜市场、富康市场~、天记酒楼~、新景酒家~、215总站~、富康羽毛球场~、富贵旅馆~、泽德幼儿园~、横窖菜市场~、泽德中医院~、广州市中医医院（同德分院）~、广州白云站,交通出行：公交：215路、17路、545路、832路、527路、524路、238路、175路、176路、196路、228路、539路、212路、241路等地铁：地铁八号线北延段（聚龙站）
一梯两户  中高层  一线望湖 南北对流,510,36773,白云,3室2厅2卫,138.69㎡,错层,板楼,高楼层(共6层),暂无数据,暂无,南,钢混结构,精装,,,该小区配套成熟~、生活方便。小区1号门出来是大型购物商场~、云门PARK~、云里~、云悦。小区内也有钱大妈~、出口商业街有银行等~、能够满足您日常的生活所需,小区最近的地铁站嘉禾望岗站~、广州地铁2、3、14号线交会站~、步行800米即可到达。公交车线路包括804路、805路、799路、920路、922路、924路、926路、509路、66路、803路等。自驾车可从白云大道北、白云堡立交~、经高速达华南快速干线三期永泰出口。
此房满五非唯一~、东北向厅出阳台~、三号线地铁口150米,230,38845,白云,2室1厅1卫,59.21㎡,平层,平房,低楼层(共13层),暂无数据,暂无,东北,钢混结构,其他,,有,,
次新房精装修两方轻松上车带包包,310,39431,白云,2室2厅1卫,78.62㎡,平层,塔楼,高楼层(共32层),暂无数据,暂无,东北,钢混结构,其他,,有,,距离3号线同和站1.5公里~、小区门口有便民车可直达地铁口~、距离华南快速同和收费站仅900米左右~、出行便利。
近地铁2号线飞翔公园站 电梯3房 精装修 有60方平台,174.3,27978,白云,3室2厅1卫,62.3㎡,平层,塔楼,低楼层(共15层),暂无数据,50.02㎡,南北,钢混结构,精装,,有,公园有街消防主题公园儿童公园消费娱乐距离1.5公里有广场距离3公里有5号停机坪购物消费~、小区方园500米有中国银行~、农业银行等等。,小区现有地铁二号线飞翔公园站~、步行700米左右~、另外预计2025年年底开通14号线二期~、2026年开通8号线远景路站
广信春兰花园 3室1厅 东北,280,30899,白云,3室1厅1卫,90.62㎡,平层,塔楼,高楼层(共9层),暂无数据,暂无,东北,钢混结构,简装,,,,
康雅花园 满五唯一 户型方正厅出阳台 业主诚心卖,103,17571,白云,2室1厅1卫,58.62㎡,平层,塔楼,高楼层(共9层),暂无数据,暂无,西,钢混结构,精装,,,该小区位于机场路北门小区旁~、小区内设有幼儿园~、后门有肉菜市场~、成熟生活社区~、有大型的购物广场--~、五号停机坪；还有白云山风景区~、云溪生态公园~、广州市体育馆~、广州市儿童公园等等~、生活便利。,公交站小区门口机场路岗贝路站机场路大道北公交站多条线路直达全城在建14号地铁线2期2号地铁线白云公园飞翔公园站小区距离高速路口150米出行方便
机电宿舍 3室2厅 南,180,18573,白云,3室2厅1卫,96.92㎡,平层,塔楼,高楼层(共7层),暂无数据,暂无,南,钢混结构,简装,,,,
乐嘉路汇祥苑两房一厅、面积39.77方、总68,68,17099,白云,2室1厅1卫,39.77㎡,平层,塔楼,高楼层(共9层),暂无数据,暂无,东南,钢混结构,简装,,,,
首付十来个  精装修 望花园 拎包即住,70,26346,白云,1室0厅1卫,26.57㎡,平层,塔楼,低楼层(共9层),暂无数据,24.43㎡,东,钢混结构,其他,,,,
一品湖山3期 南北对流 采光通透 户型方正 看房方便,620,37485,白云,4室2厅3卫,165.4㎡,平层,塔楼,低楼层(共16层),暂无数据,暂无,南北,钢混结构,其他,,有,商场：好又多、摩登邮局：梅花园邮局、同和邮局、南方医院邮政营业厅银行：工商银行、建设银行、农业银行、中国银行、农商银行、广发银行医院：一五七医院、南方医院、三九脑科医院~、同和医院。白云山医院~、友好医院,公交：B6路862B路504路502路560路791路等地铁站：三号北延线同和交通出行：公交：B6路862B路504路502路560路791路站（距离小区1.8公里
商品房南北三房两卫 .格局方正.精装保养好,252,25075,白云,3室2厅2卫,100.5㎡,平层,暂无数据,低楼层(共27层),暂无数据,76.58㎡,南,钢混结构,其他,,有,1.3km范围内有2个商场~、均为购物(完民广场(龙归店)、悦和方)~、基本可满足日常购物需求。2.生态环境优越~、3km范围内有45个公园~、距离最近的仅195m~、方便日常休闲,1.北太路柏塘村口站~、650路、701、728路、735路、797路、758路、828路等公交车~、发车较频密2.二公里夏良地铁站.3公里龙归地铁站和太和地铁站
保利紫云东向三房户型 保养新 白云棠溪TOD旁边,365,40924,白云,3室1厅1卫,89.19㎡,平层,塔楼,中楼层(共32层),暂无数据,暂无,东,钢混结构,精装,,有,小区旁边就是白云火车站离小区1公里有bai信广场家乐福永辉市场。600米有广东药科大学附属第三医院邮政储蓄广州农商行~、1.5公里有农行工行中国移动等,离小区几十米远就是在建的白云火车站~、规划有7条地铁~、2条轻轨~、1条高铁~、交通未来会很发达~、目前小区门口有公交车可接驳到地铁站
此房诚心卖~、南北对流视野开阔业主自己住~、装修保养好,445,47871,白云,4室2厅1卫,92.96㎡,平层,塔楼,中楼层(共32层),暂无数据,暂无,南北,钢混结构,精装,,有,,距离3号线同和站1.5公里~、小区门口有便民车可直达地铁口~、距离华南快速同和收费站仅900米左右~、出行便利
乐嘉路 电视台宿舍 精装方正三房  近地铁,190,27315,白云,3室1厅1卫,69.56㎡,平层,塔楼,低楼层(共15层),暂无数据,55.78㎡,东南,钢混结构,精装,,有,公园有街消防主题公园儿童公园消费娱乐距离1.5公里有广场距离3公里有5号停机坪购物消费~、小区方园500米有中国银行~、农业银行等等。,小区现有地铁二号线飞翔公园站~、步行700米左右~、另外预计2025年年底开通14号线二期。
馨雅居 南向二房 厅出阳台 保养新 阳光好 交通方便,83,14135,白云,2室1厅1卫,58.72㎡,平层,塔楼,高楼层(共9层),暂无数据,50.29㎡,南,钢混结构,精装,,,,公交：7路、63路、259路、539路、126路、254路、280路、291B路、425路、519路、524路、556路、563路、830路、831路、841路、乡村巴士1路、乡村巴士2路、夜26路~、。距离地铁口约900多米
金碧方正大两房~、带小平台~、近地铁,180,24017,白云,2室1厅1卫,74.95㎡,平层,塔楼,低楼层(共32层),暂无数据,61.01㎡,东北,钢混结构,简装,,有,,金碧新城公交路线地铁8号线小坪站金碧新城总站:7~、63路~、小坪南站:259~、539途经石井站线路126~、254~、280~、291B~、425~、519~、524~、556~、563~、830~、831~、841乡村巴士1乡村巴士2夜26
竹韵山庄93.92方两房 花园自己使用 阳光晒到客厅,358,38118,白云,2室1厅2卫,93.92㎡,平层,塔楼,低楼层(共9层),暂无数据,79.75㎡,东南西北,钢混结构,其他,,,,同泰路东接同和~、西接白云大道~、小区门口即是公交车站：颐和山庄站~、多趟公交路线经过~、例如：126/833/832/864...距离小区500米地铁站：3号北延线永泰站。距离华快入口永泰站700米。
深业金翠湾 2室1厅 北,226,28703,白云,2室1厅1卫,78.74㎡,平层,塔楼,高楼层(共26层),暂无数据,暂无,北,钢混结构,其他,,有,,
金域蓝湾 三期高层望江 三房两卫 户型方正,350,37434,白云,3室1厅2卫,93.5㎡,平层,塔楼,高楼层(共34层),暂无数据,暂无,东北,钢混结构,精装,,有,,小区近地铁6号线沙贝站~、出行方便。小区楼下有工商银行、邮政储蓄银行等。商场、大型菜市场、医院都为您的生活提供更多便利
店长聚焦：春兰花园电梯两房这户型就是实用,215,29936,白云,2室1厅1卫,71.82㎡,平层,塔楼,中楼层(共9层),暂无数据,暂无,东北,钢混结构,简装,,有,医疗一五七医院~、南方医院~、三九脑科医院等三大医院。购物有嘉裕太阳城广场~、佳润广场~、~、金箔广场；梅花园购物广场；：永旺~、沃尔玛佳润大型商场~、银行有建设银行~、工商银行~、农业银行~、招商银行,交通便利~、门口就是广州3号线北延长线京溪南方医院站~、距离珠江新城站只需5个站~、18号线800米~、一站到广州东站还有多辆公交车经过京溪路站、一五七医院
云山诗意 4室2厅 西南,650,45455,白云,4室2厅2卫,143㎡,平层,塔楼,高楼层(共18层),暂无数据,暂无,西南,钢混结构,精装,,有,,
C区望花园环境优美~、安静舒适~、高楼层阳光视野好,345,36316,白云,3室2厅1卫,95㎡,平层,塔楼,高楼层(共16层),暂无数据,79.46㎡,北,钢混结构,精装,,有,有步行街市、711便利店、OK便利店~、美容院、美发店、面包店；会所(羽毛球场、乒乓球场、大型足交通球场地、篮球场地)等生活配套设施完善！还有云门商场~、商场内有电影院~、东海酒家~、盒马生鲜等；小区有四大银行~、华夏银行~、民生银行~、平安银行~、招商银行等,一公里内有嘉禾地铁站广州大道北地铁站公交车总站线路包括804路、886路、805路、799路、920路、922路、924路、926路、509路、66路、803路等数十几条公交路线地铁线路：14号地铁线~、2号地铁线~、3号地铁
重新装修五房两卫~、南北对流采光好,828,43810,白云,5室2厅2卫,189㎡,平层,塔楼,高楼层(共16层),暂无数据,164㎡,南,钢混结构,精装,,有,商场：好又多、摩登邮局：梅花园邮局、同和邮局、南方医院邮政营业厅银行：工商银行、建设银行、农业银行、中国银行、农商银行、广发银行医院：一五七医院、南方医院、三九脑科医院~、同和医院。白云山医院~、友好医院,公交：B6路862B路504路502路560路791路等地铁站：三号北延线同和交通出行：公交：B6路862B路504路502路560路791路站（距离小区1.8公里
业主自住装修两年保养好~、格局方正~、视野宽阔,223,26523,白云,2室2厅1卫,84.08㎡,平层,塔楼,低楼层(共18层),暂无数据,75㎡,北,钢混结构,精装,,有,银行：工商银行、中国银行、建设银行、农业银行、广发银行商场：吉之岛、太阳城、沃尔玛医院：一五七医院、南方医院、三九脑科医院、黄庄菜市场酒店：七天酒店,
白云山脚 一线白云山景 刚需两房,113,20387,白云,2室1厅1卫,55.43㎡,平层,板楼,高楼层(共9层),暂无数据,暂无,东南,钢混结构,其他,,,景松苑社区生活配套设施完善交通便利环境安静是一个完善的生活社区有大型商场~、凯德广场~、广源汇~、三泰公园~、白云山景区,地铁：12号大金钟站大金钟：864~、361~、128~、76~、142~、541~、广园新村站479~、186~、284~、182~、124~、34~、540
荷塘月色　五房双主套　精装花园景　少有户型,570,37664,白云,5室2厅3卫,151.34㎡,平层,塔楼,中楼层(共11层),暂无数据,130.96㎡,东北,钢混结构,精装,,有,旺家钱大妈果园大森林药房肉菜市场公园白云山风景区南湖风景区新体育馆雕塑公园真功夫白云汇电影院美容养生黄冈,地铁2号线~、萧岗站~、公交车：祥景花园站、安华装饰城站~、途经线路有126路、663、244短线、244路、265路、268路、291A、291B、36路、563路、803路、810路、832路、841路、高峰快线5、夜22路、夜9路、615路等多条公交接驳到广州各个区
地铁11号线旁花园洋房~、东向望广大花园~、安静宜居,345,40984,白云,2室1厅1卫,84.18㎡,平层,塔楼,低楼层(共15层),暂无数据,暂无,东,钢混结构,简装,,有,小区配有幼儿园、菜市场、居委、药房、会所、儿童乐园、老人活动场所~、1000米范围内有两个公园~、一间三甲医院~、两间社区医院~、,地铁11号线上盖~、旁边还有2号线。多条公交线路就在小区门口。三元里高速口就在1公里处。
标题,总价,单价,区域,房屋户型,建筑面积,户型结构,建筑类型,所在楼层,楼层高度,套内面积,房屋朝向,建筑结构,装修情况,户梯比例,配备电梯,周边配套,交通出行
花园小区 满五年唯一  近地铁 通风采光好,235,31852,白云,2室1厅1卫,73.78㎡,平层,塔楼,高楼层(共15层),暂无数据,暂无,西东,钢混结构,其他,,有,300米内有中医药大学附属医院~、500米到达雕塑公园西门~、1000米到白云新城~、吃喝玩乐购~、有篮球场~、游泳池~、图书馆~、儿童设施~、园林鱼池~、7-11~、肉菜市场,此小区大门公交车站~、北门地铁口11号线和8号延长线~、距离2号线1.2公里~、距离5号线1公里。出行便利
乐嘉路近地铁 电梯中层精装修三房 看房方便 诚意出让,135,23507,白云,3室1厅1卫,57.43㎡,平层,塔楼,高楼层(共9层),暂无数据,暂无,南,钢混结构,精装,,有,公园有街消防主题公园儿童公园消费娱乐距离1.5公里有广场距离3公里有5号停机坪购物消费~、小区方园500米有中国银行~、农业银行等等。,小区现有地铁二号线飞翔公园站~、步行700米左右~、另外预计2025年年底开通14号线二期~、2026年开通8号线远景路站
高层南北对流~、视野开阔 安静舒适 精装自住保养新,465,46814,白云,3室2厅2卫,99.33㎡,平层,塔楼,高楼层(共31层),暂无数据,80.22㎡,南,钢混结构,精装,,有,,距离3号线同和站1.5公里~、小区门口有便民车可直达地铁口~、距离华南快速同和收费站仅900米左右~、出行便利
汇侨北区 南向高层  已改小三房  精装修,138,19834,白云,2室1厅1卫,69.58㎡,平层,塔楼,中楼层(共17层),暂无数据,56.91㎡,南,钢混结构,精装,,有,,汇侨车站公交车244A路807A路538路278路~、新市墟公车298路886路556路58路21路539路810路555路108路等等
云山诗意实用两房 高层视野 近地铁 装修保养好,330,43456,白云,2室1厅1卫,75.94㎡,平层,塔楼,高楼层(共18层),暂无数据,暂无,东北,钢混结构,其他,,有,,云山诗意小区位于黄边北路~、西门距离地铁2号线黄边站300米~、东门距离地铁3号线800米~、还有多路公交车743~、38~、798等途经小区大门直到市区各地~、交通便利
小区方正大3房稀有户型格局采光好 电梯高层 看房便利,267,31486,白云,3室1厅1卫,84.8㎡,平层,塔楼,高楼层(共9层),暂无数据,暂无,东南,钢混结构,简装,,有,广园新村好又多美食：悠悠乐美食~、聚友源~、湘村馆。(省一级)银行：银柜KTV~、咏乐会ktv。健身房。,盈翠华庭公交站：127/245/36/841/265等各大公交线路。地铁二号线飞翔公园~、即将开通的12号线景云路站。。。。
地铁口 金桂园 满五 2房 厅大房大 采光好,238,30934,白云,2室2厅1卫,76.94㎡,平层,塔楼,低楼层(共16层),暂无数据,暂无,东北,钢混结构,简装,,有,此小区有市场~、篮球场~、图书馆~、游泳池~、儿童场~、距离雕塑公园500米~、越秀公园1000米,此房距离北门11号线100米~、距离西门公交场100米~、距离5号线1公里~、距离2号线1.2公里
岭南新世界 高层精装两房 满五唯一,280,36530,白云,2室2厅1卫,76.65㎡,平层,塔楼,高楼层(共9层),暂无数据,65.95㎡,北,钢混结构,精装,,有,有步行街市、711便利店、OK便利店~、美容院、美发店、面包店；会所(羽毛球场、乒乓球场、大型足交通球场地、篮球场地)等生活配套设施完善！还有云门商场~、商场内有电影院~、东海酒家~、盒马生鲜等；小区有四大银行~、华夏银行~、民生银行~、平安银行~、招商银行等,小区最近的地铁站嘉禾望岗站~、广州地铁2、3、14号线交会站~、步行800米即可到达。公交车线路包括804路、805路、799路、920路、922路、924路、926路、509路、66路、803路等。自驾车可从白云大道北、白云堡立交~、经高速达华南快速干线三期永泰出口。
晓翠花园 电梯精装 一房一厅 业主诚意卖,81.8,22978,白云,1室1厅1卫,35.6㎡,平层,塔楼,中楼层(共9层),暂无数据,暂无,东,钢混结构,其他,,有,小区2公里有bai信广场五号停机坪购物广场凯德广场达广场~、菜市场就在棠溪恒沙隆肉菜市场~、有麦当劳有少年宫,
梅花园白云山下小区电梯中高层~、三房二卫~、风景视野好,330,31417,白云,3室2厅2卫,105.04㎡,平层,塔楼,中楼层(共10层),暂无数据,暂无,西北,钢混结构,其他,,有,配套成熟~、有佳润广场~、风情美食街~、摩登商城~、嘉裕太阳城广场~、南方医院~、一五七医院,：广州大道北梅岗路分支~、离地铁三号线梅花园地铁站步行大约800米~、步行至梅花园公交站仅500米~、多条线路直达天河越秀市区
近地铁车站~、交通方便楼层低。带阳台,72,17956,白云,2室1厅1卫,40.1㎡,平层,塔楼,低楼层(共10层),暂无数据,暂无,南北,钢混结构,其他,,,商城有新都汇购物广场、骐利广场、凯升广场、骏荣广场等~、距离同德围商圈1公里的悦汇城建面达~、属于广州西部前一、广州第二大的单体购物商城。公园有同德公园、聚龙公园、石井河绿道等可供居民日常健身休闲的地方,地铁8号线上步站公交：752、夜80、134、175、176、17、17短线、196、212、215、215长线、228、238、241、524、527、539、543、545、62、832、975、高峰快线26、高峰快线27、高峰快线29、高峰快线2、高峰快线3、高峰快线51、夜15、夜21、夜2、夜76
越秀房产 精装南向3房 望花园,370,38327,白云,3室2厅2卫,96.54㎡,平层,塔楼,低楼层(共32层),暂无数据,78.65㎡,南,钢混结构,精装,,有,,距离3号线同和站1.5公里~、小区门口有公交车可直达地铁口~、距离华南快速同和收费站仅900米左右~、出行便利
黄石花园 原装电梯 望园林 安静舒适,190,21409,白云,2室2厅1卫,88.75㎡,平层,塔楼,中楼层(共14层),暂无数据,暂无,南,钢混结构,简装,,有,商场：南门150米是白云汇广场。菜市场：楼下150米是小区东门~、祥景综合市场。医院：社区医院、有白云区人民医院、广州中医药附属医院、白云区黄石医院江夏门诊部。银行：有建设银行、工商银行、农业银行、交通银行、邮政储蓄银行,途经黄石路公交车站：126~、563~、803~、244~、929~、841~、742~、265~、810~、832~、278~、982~、794.等等。地铁二号线江夏站或萧岗站~、在建14号线马务地铁站
位置安静~、户型方正 业主诚意放卖,200,25560,白云,2室1厅1卫,78.25㎡,平层,塔楼,低楼层(共12层),暂无数据,暂无,北,钢混结构,精装,,有,凯德广场~、五号停机坪~、B信广场~、白云汇医院：白云区人民医院~、黄石社区医院~、广州医药大学第三附属医院~、中医学院~、南方医院银行：中国建设银行~、工商银行~、中国银行~、交通银行~、农业银行,小区出门200米左右就有公交站牌离地铁2号线白云文化广场地铁口900米左右
机场小区电梯平层楼东向望白云山,245,26747,白云,2室2厅1卫,91.6㎡,平层,塔楼,低楼层(共13层),暂无数据,79.2㎡,东,钢混结构,其他,,有,,
龙光玖誉府 三房两厅两卫 南向靓装望花园,246,27706,白云,2室2厅1卫,88.79㎡,平层,板塔结合,低楼层(共32层),暂无数据,暂无,东南,钢混结构,其他,,有,绿化好~、环境优美~、人车分流~、宁骏物业管理有限公司~、24小时安保~、采光通风佳物管费2.8/m2管理有序~、设有游泳池~、儿童乐园区~、足球场~、乒乓球台~、篮球场等便利店~、肉菜店~、快递驿站..,门口有8号线北延线和24号线的双地铁~、楼下更有各路公交~、广花快速路加速交通~、使其小区邻近产业发展更好~、公交706
此房装修保养好户型格局好~、位置安静舒适~、通风采光足,127,23981,白云,2室1厅1卫,52.96㎡,平层,塔楼,中楼层(共9层),暂无数据,暂无,东北,钢混结构,其他,,,距离小区300米有大型商场安华汇~、350米有博济医院~、医疗设施齐全~、400米有解放庄菜市场和陈田公园等,从小区到黄边地铁口大概900米~、到江夏地铁口大概1.2公里~、小区外面有白云花园公交总站~、交通便利。
单边位~、四房两卫~、花 园和负一层,495,37244,白云,3室2厅2卫,132.91㎡,错层,塔楼,低楼层(共8层),暂无数据,111.32㎡,南,钢混结构,其他,,有,享有岭南新世界商圈的配套~、便利店~、chao市~、菜市场~、地铁二号线和三号线~、小区门口就有大型chao市和商场,小区门口的50米有公交车站~、有922、66等线路经过~、开车出行300米到白云大道~、450米到华南快速路永泰收费站~、通达天河越秀。400米到地铁三号线白云大道北站~、或者乘坐便民车到嘉禾望岗站乘地铁~、交通方便。
