标题,总价,单价,区域,房屋户型,建筑面积,户型结构,建筑类型,所在楼层,楼层高度,套内面积,房屋朝向,建筑结构,装修情况,户梯比例,配备电梯,周边配套,交通出行
星汇二期南向3房2卫、装修新、保养好,270,28223,白云,3室2厅2卫,95.67㎡,平层,塔楼,中楼层(共32层),暂无数据,78.5㎡,东南,钢混结构,其他,,有,小区正门距离浔峰山生态公园约1780米商场小区正门距离金沙洲永旺梦乐城约500地铁小区正门距离6号线地铁浔峰岗站约1500米小区正门距离金沙幼儿约450米,
单边位、采光好、精装修、保养好、拎包入住,128,15764,番禺,3室2厅1卫,81.2㎡,平层,塔楼,高楼层(共7层),暂无数据,暂无,西南,钢混结构,其他,,,近大石繁华地段、500米内有大型菜市场、商场、近市区方便、有关帝岗和大石文化广场,
尚东阳光两房、中高楼层朝南、采光好、通风好,119,13627,增城,2室1厅1卫,87.33㎡,平层,塔楼,中楼层(共25层),暂无数据,暂无,南,钢混结构,毛坯,,有,金融配套：中国银行股份有限公司广州增城新塘支行、饮食配套：聚福海鲜酒家、胖子川菜馆(增城市公路路政管理所新塘分所南)、肯德基(新塘大道店)、医院：新塘医院湛兆霖眼科、新塘医院(群星幼儿园西)、省水电医院、暨华医院,地铁13号线沙村站（900米）.尚东阳光公交车站：增城39路和大润发、吉之岛免费楼巴（266米）.沙村公交车站：571、22、25、29.39.45等（900米）广园快速出口（1700米）
星汇金沙花园、满五唯一税费低 东南向三房二卫。,256,26714,白云,3室2厅2卫,95.83㎡,平层,塔楼,高楼层(共25层),暂无数据,77.63㎡,东南,钢混结构,精装,,有,地铁6号线离小区1500米、地铁12号线正在建设中、预计2025年开通、有永旺梦乐城、~达~~、国昌城市广场、沙田~~、永润广场、金铂~市等等、小区楼下有多家生鲜~市。,楼下有公交车12路、276路、283路、790路。距离浔峰山生态公园约1780米、距离永旺梦乐城商场500米、距离地铁6号线1500米、距离金沙幼儿园4500米、配套设施齐全、出行便捷！公交：283路、12路、276路公车直达；自驾车路线：内环路A/B线增槎路方向—金沙洲.
合益小区 精装两房 格局方正 通风采光靓,105,21460,白云,2室1厅1卫,48.93㎡,平层,板楼,低楼层(共9层),暂无数据,44.21㎡,南,钢混结构,精装,,,离地铁口紧2公里左右新建白云火车站在小区开工政府已经准备改造小区小区近菜市场买菜方便小区门口有保安小区内有24小时监控居住安全小区有绿化有散步空间有大道中公交车站可以到达广州的各个地方交通便利.,地铁2号线、地铁8号线聚龙地铁站、公车:185路7路975路424路103路105路115路113路63路555路556路540路等等
天荟南向两户 型格局方正 楼层好采光充足,230,25989,番禺,2室1厅1卫,88.5㎡,平层,塔楼,中楼层(共45层),暂无数据,68.46㎡,南,钢混结构,其他,,有,亚运城广场、金嘉农贸市场、永德肉菜市场、碧乐时光、钱大妈、华润、优加、广州医科大学附属第二医院（三甲）、番禺第七人民医院、工行、建行、小区内设有游泳池、篮球场等、配套设施很完善,1、双地铁：4号线海傍站、3号线东沿线2、公交：番162B路、番162路到技术官员村站；番148路到裕丰村站；番149路到亚运城站；番160路到媒体村站、路经：房管局、永旺梦乐城、市桥、莲花山3、开车亚运大道、广澳高速、南沙港快速
精装修 南向望江 视野开阔  出行方便,825,75821,海珠,4室2厅2卫,108.81㎡,平层,塔楼,高楼层(共55层),暂无数据,86.7㎡,南,钢混结构,其他,,有,下楼就是纸厂公园、环境优美、距离庄头公园500米、医疗：广州医学院第二附属医院、南方医科大学医院、红十字医院。配套华润华新方圆333广场、纸厂肉菜市场、石溪肉菜市场等。银行：邮政银行、建设银行、中国银行、工商银行等。,地铁：双地铁配套、广佛线燕岗站、11号环城线南石路站公交：纸厂邮局站（29、31、230、963、469号公交）、纸厂总站（29、469、544、夜32号线）、纸厂横马路总站（230号线）
紫薇丽都 少有南向 中高层三房两卫 证在手,178,19604,花都,3室1厅2卫,90.8㎡,平层,塔楼,中楼层(共14层),暂无数据,暂无,南,钢混结构,精装,,有,交通配套成熟商圈有大型商场和酒店旺中带静小区人车分流车位不紧张很多,商场地铁高速都十分便利都是步行到达、出入方便、交通便利
龙湖三房 全新未入住 直接可望凤凰湖 安静居住,220,22572,黄埔,3室2厅2卫,97.47㎡,平层,板塔结合,中楼层(共31层),暂无数据,暂无,北,钢混结构,其他,,有,,地铁14号线旺村站、何棠下站、3站到达镇龙接驳21号线6站可到达员村。往南走广河高速接华南快速干线到天河、往北走广从公路直达白云345路352路365路370路445路旺村A出口343路345路352路365路370路445路地铁旺村、汤村、何棠下、知识城房主自..
近地铁、新装修两年、小清新风格、电梯两房、拎包入住,150,17453,增城,2室1厅1卫,85.95㎡,平层,塔楼,低楼层(共18层),暂无数据,70.7㎡,北,钢混结构,精装,,有,,小区位于13号线沙村地铁口旁、线路和距离如下：地铁：13号线沙村地铁站（小区北门到地铁口20米）公交车：（沙村地铁站）571路、增城22、24、25、29、39、45路（小区北门到公交车站20米）。
裕景花园 3室2厅 南,1680,90615,天河,3室2厅2卫,185.4㎡,平层,塔楼,低楼层(共31层),暂无数据,150.01㎡,南,钢混结构,精装,,有,,
2003年楼龄 宝翠苑 低楼层 希有露台南向四房 满五唯一,165,17498,番禺,4室2厅1卫,94.3㎡,平层,板楼,低楼层(共6层),暂无数据,81.6㎡,南,钢混结构,精装,,,1公里范围内有多家购物广场、例如奥园广场、西丽广场、荔园新天地等等、包括有多家银行、社区医院和公园等。有大型肉菜综合市场和水果市场、日常生活便利、出行购物都方便。,公交：番22b路;番22路;番2长线;番2；7路、67路(三桥北站)、小区门口有公交站。
镇北路、低楼层、格局方正、满五唯一、业主诚心出,55,6998,从化,2室1厅1卫,78.6㎡,平层,塔楼,低楼层(共6层),暂无数据,暂无,东,钢混结构,精装,,,,
电梯楼平层、二房一厅近地铁出入方便。,138,22038,白云,2室1厅1卫,62.62㎡,平层,板楼,高楼层(共9层),暂无数据,暂无,北东,钢混结构,其他,,有,积德花园配套：中国银行、工商银行、白云区中医院、酒楼、骏荣广场食街、同德上步广场、家私城、菜市场、富康市场、天记酒楼、新景酒家、215总站、富康羽毛球场、富贵旅馆、泽德幼儿园、横窖菜市场、泽德中医院,近广州白云火车站、地铁8号线上步站、公交车：215、832、241、196、179、175、545、543等路
店长推荐 金融城板块 近地铁 方正舒适优选两房,270,32224,天河,2室1厅1卫,83.79㎡,平层,塔楼,中楼层(共16层),暂无数据,暂无,北,钢混结构,其他,,有,小区出门就是一条美食街。好又多、卜蜂莲花、沃尔玛。医院：家家乐医院、红十字会医院、天河人民医院。邮局：东圃邮局、天朗明居邮局。银行：中国银行、招商银行、交通银行、农业银行等,距离21号线棠东地铁站300米、距离4号线、13号先车陂站1.2公里、有多条公交线路。
次新小区配套齐全  户型通透  人车分流 带车位,138,15641,南沙,3室1厅1卫,88.23㎡,平层,塔楼,中楼层(共27层),暂无数据,72.38㎡,南北,钢混结构,精装,,有,小区位于金洲板块成熟商圈居民素质高小区门口就有底商钱大妈等小型商场、300米小区一条马路距离有明珠花园大型农贸市场华汇广场门口公交车站接驳旁边就有蝴蝶洲公园黄山鲁四A级森林公园,小区楼下100米就有公交站直接接驳18号线横沥站、金州站蕉门站南沙公交站总站出行便利未来15号线规划站蝴蝶洲站
房子满五唯一省税、南向户型方正实用。,380,41395,白云,3室1厅1卫,91.8㎡,平层,塔楼,高楼层(共18层),暂无数据,76.66㎡,南,钢混结构,其他,,有,小区出门口200米内就有华润、西亚兴安chao市、大森林药店、生鲜店、养发馆、农业银行、中国银行、建设银行、工商银行、7-11、全家便利店、生活方便。,小区位于2号线黄边站上盖、交通便利、小区三期东门出门口步行50米就可以到达2号线黄边站以及公交站：38、58、798、831、794路、出行便捷。
南沙金茂湾 4室2厅 南 北,370,26393,南沙,4室2厅2卫,140.19㎡,平层,塔楼,低楼层(共32层),暂无数据,暂无,南北,钢混结构,精装,,有,,
电梯中层安静舒适三房 全明户型,396,50331,天河,3室2厅1卫,78.68㎡,平层,板楼,中楼层(共18层),暂无数据,64.39㎡,北,钢混结构,其他,,有,小区楼下有华润市场、美宜佳、钱大妈等各种生鲜市场。有银行、校园、医院等衣食住行很方便。去华南农业大学1.1公里、去天河客运站1.8公里、去旁边长湴公园600米公交站B11、722A、722、20、581等多趟,出行方便、门口有公交车站、去地铁两站就可到五山地铁、距离天河客运站地铁最近1.6公里就可到、门口有公交车到达
尚东尚筑3房2卫南向地铁口近在咫尺 高层开阔园林景观,385,34098,番禺,3室2厅2卫,112.91㎡,平层,塔楼,中楼层(共18层),暂无数据,94.98㎡,东南,钢混结构,其他,,有,小区位于地铁3号线傍江地铁口上盖的、距离傍江地铁口D出口近在咫尺距离、出行方便！尚东汇购物广场、水果店：银行：中国银行、广州农商银行、中国农业银行、中国工商银行；医院：何贤医院、番禺中医院；方便您的出门和生活,多条公交线路经过小区公交站牌、直达番禺汽车客运站、地铁口傍江站近在家门口、南沙、南郊、大夫山风景区、广州等地交通方便
康裕园东区  73方三房双卫 南向 住家装修 有固定车位,148,20055,番禺,3室1厅2卫,73.8㎡,平层,塔楼,低楼层(共7层),暂无数据,暂无,南,钢混结构,简装,,,购物：新大新、钻汇、大北路。买菜：西丽市场、番山市场、钱大妈。医院：中医院、何贤医院、市桥医院。公园：星海公园、城北公园。交通：有多台公交车直达各地、公交3站到市桥地铁1.2公里、小区楼下有多路公车经过。,交通方便：公交：15路、16路、22B路、22路、23路、2路、3路、4B路、4路、6B线、6路、7路、9路地铁：3号线市桥站。
南向 楼间距宽 采光好 通风好 户型方正,350,51320,天河,2室1厅1卫,68.2㎡,平层,塔楼,低楼层(共8层),暂无数据,暂无,南,钢混结构,其他,,有,下楼即到体育东菜市场和生活广场、生活氛围浓郁、天河城、天环广场、正佳广场、太古汇等都在步行范围,3号线石牌桥站/18号线c冼村站、多路公交通往广州各处、四通八达、出行便利
黄埔区地铁口3房、中高层、视野好、采光充足,165,19339,黄埔,3室2厅1卫,85.32㎡,平层,板塔结合,高楼层(共30层),暂无数据,暂无,南北,钢混结构,精装,,有,,A坳岗345路352a路365路370路445路B棠下村口343a路345路352路365路370路445路地铁14号线旺村、汤村、何棠下、知识城
上下九商圈西关独栋私房东西对流朝向前后通,400,25688,荔湾,4室2厅2卫,155.72㎡,平层,暂无数据,低楼层(共1层),暂无数据,155㎡,东南,砖木结构,简装,,,配套设施齐全、永庆坊、第十甫路、有黄沙领展大型商场、菜市场、广医三院、广医口腔医院等成熟配套、近地铁站、距离1号线、6号线黄沙双地铁站步行距离仅150米左右、还有两个景区公园--沙面公园、荔枝湾风景区、环境安静、空气清新,公交出行方便、双地铁、1号线+6号线双地铁黄沙站、长寿路地铁站、广州东、公交总站、黄沙公交总站码头、黄沙码头
平层入户、户型方正、采光通透、装修新、交通方便、,75,28969,海珠,1室1厅1卫,25.89㎡,平层,塔楼,中楼层(共9层),暂无数据,暂无,西南,钢混结构,精装,,有,,小区门口双地铁2号线10号线（即将开通）600米环城高速入口海珠隧道在建20分可达广州南站
贝丽花园 证满五年 全明格局厅出阳台 业主诚意卖,205,25558,白云,3室1厅1卫,80.21㎡,平层,塔楼,低楼层(共15层),暂无数据,暂无,南北,钢混结构,简装,,有,小区位于岗贝路、各类美食小吃火锅简直就是吃货的天堂；白云新城、大型购物广场有五号停机坪、凯德广场、达广场、信广场等；,区出口100米岗贝路东公交站、475/741/757到三元里地铁站、白云公园、飞翔公园地铁站、只需几个站。机场北门岗贝站还有二十多条公交车往返市区、另外规划中地铁十四号线岗贝站已经在动工、预计2025年年底通车。
海伦堡流金岁月 4室2厅 西南,548,86273,番禺,4室2厅3卫,63.52㎡,平层,塔楼,中楼层(共28层),暂无数据,暂无,西南,钢混结构,精装,,有,,
区府版块 小城之春 圆玄旁大四房 带露台 钥匙在手,200,14702,花都,4室2厅2卫,136.04㎡,平层,塔楼,低楼层(共28层),暂无数据,106.98㎡,南北,钢混结构,其他,,有,,
南向视野宽阔、楼层低但采光充足、带车位,130,10326,增城,3室2厅2卫,125.9㎡,平层,板塔结合,低楼层(共25层),暂无数据,96.34㎡,南,钢混结构,精装,,有,西福河位于小区南边、西福河有跑步绿道、观景台、跑道长5公里、饭后休闲娱乐好去处。距离朱村农贸批发市场路程3公里、小区有完善底商、理发店、药店、餐饮都具备。医院有朱村医院、三甲妇幼儿童医院。,出行广州21号线地铁凤岗站、步行1公里左右、地铁口可停放电动车、公交车71路、2路、增城11路
不想为了装修烦恼？选它 毫华装修 全屋定制,385,48422,天河,3室2厅1卫,79.51㎡,平层,塔楼,高楼层(共31层),暂无数据,暂无,南,钢混结构,精装,,有,十五年成熟生活配套双公交总站各大银行饭店菜市场便利店水果店花店进口美食店美容修身连锁店健身会所服装店,出小区门口200米就是公交站翰景路站距离小区400米就是华景新城公交总站有五路公交车坐三个公交站就可以去到地铁3号线华师站交通便利
中楼层看大草坪、中高楼层、视野宽阔、采光好,288,20426,花都,4室2厅2卫,141㎡,平层,板楼,中楼层(共32层),暂无数据,113㎡,南北,钢混结构,毛坯,,有,配套有麦当劳；善待家商场。药店、东镜市场宜客多雅瑶医院广州农商银行、花都区镜湖幼儿园半岛幼儿园、距离花都人民医院4公里左右,公交路线；706、703、707到东镜市场站、花29路到东镜村站、目前小区有楼巴自由人到龙归地铁站B1出口、自驾车；华南快速--广州绕城高速公路--广花公路、花都自由人紧靠北环、机场高速出口、机场高速（规划地铁口在小区旁镜湖大道站）
融创西板块、皮革城商圈、复式大平层,198,9257,花都,6室2厅4卫,213.91㎡,平层,塔楼,高楼层(共10层),暂无数据,暂无,南,钢混结构,简装,,有,广州市花都区第二人民医院、广州花都狮诚中西医结合医院、广州花都狮岭合益门诊部购物：狮岭·纳海皮具饰博园、合成市场、香港街校园：合成、育才、狮岭、狮峰等,小区门口有公交站连接狮岭旧区跟花都市区、广州市区！双向八车道主干道狮岭大道东距离海布高速路口仅2公里！距离白云机场仅35公里！
恒大绿洲花园 4室2厅 东南,645,36032,白云,4室2厅2卫,179.01㎡,平层,塔楼,高楼层(共11层),暂无数据,151.24㎡,东南,钢混结构,其他,,有,,
赤岗路封闭式大院管理环境好户型方正 南北对流采光好,292,37785,海珠,2室1厅1卫,77.28㎡,平层,塔楼,中楼层(共8层),暂无数据,暂无,南,钢混结构,简装,,,距离赤岗大市场200m、大型生活商店100m、门口两个花店以及各种便民商店、水果店、家门口可以解决生活基本需,赤岗站（地铁8号线）；客村站（地铁3、8号双地铁线）公交：赤岗路站（69路；130路；184路；190路；226路；250路；夜45；快线39路）
合生湖山国际保养好山景两房、采光通风好安静,160,17162,增城,2室2厅1卫,93.23㎡,平层,塔楼,高楼层(共25层),暂无数据,67.95㎡,北,钢混结构,其他,,有,小区门口拥有未来汇及克拉邻里两大美食街有建设银行东门有麦当劳星巴克及大型购物商场便利店药店养生馆另外项目距离1500米就有医疗配套完备的暨华医院,小区门口有翡翠绿洲公交车总站公交25号线可到地铁13号线沙村站白江站增437到南岗站、1交通出行方便项目的路边还有有轨电车站规划
岭南湾畔东南向望园林三房、格局方正实用、装修保养好.,540,54277,荔湾,3室1厅1卫,99.49㎡,平层,塔楼,低楼层(共32层),暂无数据,暂无,东南,钢混结构,精装,,有,【悦汇城】大型广场、老伙计茶楼、周记饭店、食为天、小炳胜、有荔湾区中医院、建设银行、农业银行、肯德基、麦当劳。若比邻、公园有增埗公园,五号线西村站800米、八号线鹅掌坦站500米、公交：17、62、71、80、134、175、176、179、196、212、215、238、241、524、543
宏宇广场 3室1厅 东南,360,37788,海珠,3室1厅1卫,95.27㎡,平层,平房,高楼层(共31层),暂无数据,80.86㎡,东南,钢混结构,精装,,有,,
越秀滨海悦城精装大二房 保养好 户型方正 诚心卖,128,14536,南沙,2室2厅1卫,88.06㎡,平层,塔楼,低楼层(共31层),暂无数据,暂无,北,钢混结构,精装,,有,近金洲蕉门地铁站、蕉门河公园购物广场、板头市场、水岸广场、星河coco·park、医疗有南沙人民医院、妇女儿童医院、中山医等；,距离金洲地铁站600米、蕉门公园1公里、小区楼下就有公交站接驳可到南沙各个区域、一站地铁到蕉门公交总站、还可直达白云机场、广州南站、深圳机场等各大交通枢纽站、出行便捷节省时间；
证在手、无抵押、产权清晰、朝向好、高楼层,110,5663,花都,4室2厅2卫,194.26㎡,平层,塔楼,高楼层(共19层),暂无数据,暂无,东西,钢混结构,毛坯,,有,碧华市场（小区门口）东福商场（离小区1000米处）乐卖特商场华润宛家骏壹宛邦融创文旅城医疗配套：花都第二人民医院（3公里处）胡忠医院花都人民医院旅游配套：芙蓉嶂度假风景区花卉之都香草世界盘古王庙融创雪世界／滑雪v,小区内配备游园穿梭巴士方便业主随时出入小区、每日往返广州市区的楼巴、楼巴直达广州花园酒店地铁口。往返地铁9号线花都广场站巴士。小区设有89路公交车、86路公交车、其中86路途经花都广场地铁站
禺丰园 交通便利 配套成熟 近地铁 可公积金,103,11064,番禺,3室2厅2卫,93.1㎡,平层,塔楼,高楼层(共8层),暂无数据,84.2㎡,南,钢混结构,简装,,,医院：广州市番禺区市桥医院、广州市番禺区中医院、广州市番禺区何贤纪念医院、广州市番禺区市桥街社区卫生服务中-心、广州市番禺区中-心医院；购物：西丽广场、繁华盛世、正太广场、沙头市场、市桥西区肉菜市场。,公交车：广州市番禺区番16路;番23路;番27路;番67路旅游专线；地铁：距离3号线市桥地铁站1.3公里
：满五唯一 税少 、 格局方正、采光好、安静,328,25231,番禺,4室1厅2卫,130㎡,平层,塔楼,低楼层(共9层),暂无数据,110㎡,北,钢混结构,其他,,有,番禺广场3号线地铁东延线、距地铁口约500米、通勤便利!小区门口公交站有多条公交线路经过、去石楼、市桥、桥南、番禺广场地铁站都方便。小区物业管理严格服务到家让你生活放心、小区绿化面大绿树成荫活动老少皆宜、小区人文素质高,出小区1公里左右到金海岸公交站：番29路、番93路、番1路、番26路；出小区500米左右有3号傍江地铁站
合生湖山国际5期峰荟 4室2厅 南,239,17651,增城,4室2厅2卫,135.41㎡,平层,塔楼,中楼层(共32层),暂无数据,暂无,南,钢混结构,简装,,有,,
榕溪花园 、方正实用大两房 采光通风好,136,17198,白云,2室1厅1卫,79.08㎡,平层,塔楼,中楼层(共8层),暂无数据,70.2㎡,西,钢混结构,其他,,,好又多、家乐福、广*新市店、石井城市广场、餐饮：连锁酒店、银行、农业银行、建设银行、中国银行,石井站：126、254、280、291、425、519、524、556、563、830、831、841、乡村巴士1、乡村巴士2、夜26、地铁8号线小坪站
小区正中间位置、好楼层、全屋索菲亚定制、保养好,300,26930,增城,3室2厅2卫,111.4㎡,平层,塔楼,中楼层(共24层),暂无数据,90.92㎡,南,钢混结构,精装,,有,凯达尔、奥园康威广场、腕达广场、永旺梦乐城、腕禾购物广场医院：南方医院新塘分院（三甲）、增城区医院（三甲）银行：中国建设银行、中国工商银行、中国农业银行、中国银行小区内部配套：幼儿园、图书馆、街、儿童游乐场、游泳池、会所,地铁13号线官湖地铁站、16/23号线（规划）；广汕铁路、广深铁路、穗莞深城轨等；京港澳高速、广源快速路、G107国道、荔新公路、济广高速
此房满五唯一、格局方正、地段优越、交通方便,79,8781,花都,4室1厅1卫,89.97㎡,平层,塔楼,中楼层(共5层),暂无数据,暂无,南,混合结构,其他,,,有地铁口、秀全公园、新世纪广场、新华市场、步行街、粮油批发市场、大型购物商场、有医疗配套、花都区人民医院、花都区妇幼保健院建设院区,
南向望花都湖景观、上车盘配套齐全、下楼即到花都湖,148,16515,花都,3室2厅1卫,89.62㎡,平层,塔楼,高楼层(共23层),暂无数据,70.47㎡,南,钢混结构,简装,,有,,
芳园居教师新村--电梯2房  保养新,170,22191,荔湾,2室1厅1卫,76.61㎡,暂无数据,塔楼,低楼层(共25层),暂无数据,62.86㎡,东南,钢混结构,其他,,有,,小区门口有公交车站、同区或跨区都方便、800米左右有1号线地铁、让居民出行无忧。
南向、靓楼层、双地铁出行方便。,218,23104,黄埔,3室2厅2卫,94.36㎡,平层,暂无数据,中楼层(共34层),暂无数据,暂无,东东南,钢混结构,其他,,,,双地铁、距14号线支线(知识城线)/21号线-镇龙A口55米；距14号线支线(知识城线)/21号线-镇龙B；在建轻轨站H出口；公交地铁镇龙总站
东翠花园金麟台 3室1厅 西南,460,44436,海珠,3室1厅2卫,103.52㎡,平层,塔楼,中楼层(共28层),暂无数据,暂无,西南,钢混结构,其他,,有,,
永福路1号大院、平层电梯、一梯两户,550,53859,越秀,3室2厅1卫,102.12㎡,平层,塔楼,中楼层(共7层),暂无数据,暂无,南,钢混结构,简装,,,公园：广州动物园、黄花岗公园、东风东公园：菜市场：科学院菜市场、沙河顶菜市场：交通：6号线黄花岗站、动物园站；公交站：广州动物园、永福路等。,
自由人四期三房两卫、装修保养好。,170,15847,花都,3室2厅2卫,107.28㎡,平层,塔楼,低楼层(共32层),暂无数据,暂无,南,钢混结构,精装,,有,小区家门口就有大型购物配套、步行500米即可购物。每逢节假日更添加夜市小吃街、让业主更加方便。,
广园中路 职业学X 单位宿舍楼 宜居方便,100,20611,白云,1室1厅1卫,48.52㎡,平层,暂无数据,中楼层(共8层),暂无数据,43㎡,南,钢混结构,简装,,,购物：越秀广源汇广场、五号停机坪、凯德云尚、无限广场、白云达广场公园：雕塑公园、三泰公园、还可以到白云山风景区三甲大医院中医学院第附属医院、广东省第二中医院白云院区、等景泰社区医院,地铁：即将建成开通双铁11号线、12号线、目前可乘坐2号线飞翔公园站公交：186、284、479、921、124、182总站还有175、179、181、189、199、210、241、24、257、265、273、278、298、32、38、46、540、60、63、810、34等公交客运站：广园客运站
低楼层望园林、安静四房、配套齐全,270,19683,南沙,4室2厅2卫,137.18㎡,平层,塔楼,低楼层(共26层),暂无数据,115.5㎡,南北,钢混结构,精装,,有,楼下就有珺城街市、种类齐全、1500米到达蕉门河公园、800米到达南沙医院！！地铁500米飞沙角站（数据源自高德测距）,门口就有公交车站、可以到达南沙各地、500米到达飞沙角地铁口、5个站到达庆盛高铁站、可以到达全国各地！
