标题,总价,单价,区域,房屋户型,建筑面积,户型结构,建筑类型,所在楼层,楼层高度,套内面积,房屋朝向,建筑结构,装修情况,户梯比例,配备电梯,周边配套,交通出行
全新中高层 视野开阔、通风采光好、总预算低,199,22112,南沙,3室2厅2卫,90㎡,平层,塔楼,高楼层(共24层),暂无数据,75㎡,东北,钢混结构,其他,,有,楼下公交车站通往横沥地铁18号线有5.5公里灵山岛江边公园、休闲、运动、观景的好去处,
聚德西区哇塞 三房方正户型 中楼层光线足,238,32987,海珠,3室1厅1卫,72.15㎡,平层,塔楼,中楼层(共9层),暂无数据,60.38㎡,北,钢混结构,简装,,有,购物六福广场、珠影广场沃尔玛商场、饮食美食街、江海大道美食街、医院省二医产业、磨碟沙IT大厂、广州地铁IT科贸园。,地铁:3号线大塘站、8号线赤岗站（up智谷地铁专线车直达）大塘公交总站：226路、130路、184路、190路、20路、69路、763路等公交线路
金宇花园 户型方正实用 配套成熟 交通便利,170,24196,荔湾,2室1厅1卫,70.26㎡,平层,塔楼,低楼层(共9层),暂无数据,暂无,东南,钢混结构,精装,,有,生活配套成熟、肉菜市场、儿童乐园、医院、银行、宾馆酒楼、衣食住行。交通方便户型方正装修新净小区绿化环境好,私家车和公交车都方便出行小区北门有公交车总站有52号64号277号121号780号769号417号等公交线路小区路口出来就可以上环城高速
中楼层看湖景、格局方正一梯三户,568,30111,白云,3室2厅3卫,188.64㎡,平层,板楼,中楼层(共9层),暂无数据,169.32㎡,西南,钢混结构,其他,,有,区楼下有华润、钱大妈、健身房都有、3公里范围内有金铂广场、太阳城、医院三甲医院南方医院,小区离华南高速路口入口处1.5公里、途径小区的公交车有：504.747.792A.792.862B.B6等公交线路、出行方便。两站到同和地铁站
美林海岸 西南向三房 几年出一套 采光视野好看小蛮腰,750,74501,天河,3室1厅2卫,100.67㎡,平层,塔楼,中楼层(共12层),暂无数据,暂无,南,钢混结构,精装,,有,区配套齐全小区自带会所泳池、网球场、儿童游乐场、小区北门和东门都有各种生鲜水果便利店餐饮店。1公里有麦德龙、麦当劳等。距离临江带状公园100米。北门有克莱顿酒店和伊斯丹顿酒店。,小区北门距离135米是公交总站、有B11路、243路；距离小区东门334米琶洲大桥北站、有23路、43路、227路、261路、298路；距离小区北门890m是地铁5号线科韵路站。小区北面是椰林路接驳员村四横路、东面科韵路和琶洲大桥。交通四通八达
科学城上车盘南北通透全屋定制望花园视野开阔保养新,135,16068,黄埔,3室1厅1卫,84.02㎡,平层,板塔结合,低楼层(共34层),暂无数据,暂无,南北,钢混结构,精装,,有,,
二期东南向、精装修三房、拎包入住、户型方正好用,285,33577,黄埔,3室2厅0卫,84.88㎡,平层,塔楼,低楼层(共17层),暂无数据,暂无,南,钢混结构,精装,,有,小区东边是茅岗的改造、是富力拿的地、后期建住宅、预估明年动工、小区正南面是广建集团总部广建鱼珠湾字楼（在建）小区距离13号线二期珠村站860米（在建）、小区斜正面有大型的漫广场商场、海底捞等、2公里金融城、有山姆会员店、美林新天地、宜家家居等,途经公交车：B1、B26、B16路、B17路、B20路、B27路、B5路莲溪-公交车站途经公交车：41路夜班、46路夜班、550路、B15路、B1快、B1路、B20路、B26路、夜13路：地铁5号线和13号线鱼珠站交通发达、小区门口有便民车接驳地铁
江边物业、框架结构、70年到2094.10.30止、一梯三户。,220,31483,海珠,2室1厅1卫,69.88㎡,平层,板楼,高楼层(共7层),暂无数据,暂无,南,钢混结构,简装,,,老城区配套成熟、交通便利、旺中带静。离滨江西、同福西商圈近。、医院有市三甲红十字会医院、有菜市场。,地铁：2号线市二宫地铁站一站到海珠广场站、可换成六号线、1站到公园前换乘1号线、滨江公交滨江西站同福西站市红十字会医院站经过同福中的线路有10路、16路、183路、25路、270路、530路B21路夜37路
业主诚心放卖、户型方正实用、通风采光好,255,27120,白云,2室2厅1卫,94.03㎡,平层,塔楼,高楼层(共21层),暂无数据,70.12㎡,南,钢混结构,其他,,有,地铁6号线离小区800米、地铁12号线正在建设中、预计2025年开通、有永旺梦乐城、金铂等等、小区楼下有多家生鲜,公交283路、12路、276路直达市区、公交790直达地铁站和金沙洲内。地铁6号线已开通、地铁12号线2025年开通。出行便利！
鹭江地铁口单位大院 有小区管理 低层精装两房刚需上车,143,21018,海珠,2室1厅1卫,68.04㎡,平层,塔楼,低楼层(共8层),暂无数据,58.27㎡,南,钢混结构,精装,,,商场：宏城、好又多、丽影广场、华润医院：海员医院、广东省第二医院、新海医院邮局：赤岗邮政局银行：工商银行、建设银行、农业银行、交通银行、民生银行,公交：8路、11路、24路、83路、121路、131路、182路、204路、229路、247路、266路、272路、822路、882路230路、252路、301路、303路、37路、45路、51路。地铁：8号线鹭江站
花季小区电梯方正二房、东南向。,228,28865,白云,2室1厅1卫,78.99㎡,平层,塔楼,低楼层(共14层),暂无数据,暂无,西南,钢混结构,简装,,有,此房距离游泳池100米、距离篮球场200米、距离市场300米、距离医院300米、距离雕塑公园,此房楼下11号线地铁口上盖、距离11号线50米距离中医学院200米、、距离5号线1公里
证够五年唯一、广州北、近地铁、全新装修、南北通透。,68.8,8710,花都,3室2厅2卫,78.99㎡,平层,暂无数据,高楼层(共6层),暂无数据,暂无,南北,混合结构,精装,,,房子近太子步行街、广州北、秀全公园、花都湖公园、花都区人民医院、新华市场、地铁站300米.,距离广州北站400米、高铁城轨、地铁站400米、汽车客运站300公里、交通出行便利楼下公交车站、703.706.8路705路
豪景花园 少有南向大两房 中楼层 采光通透 过五唯一,290,34840,天河,2室2厅1卫,83.24㎡,平层,塔楼,中楼层(共19层),暂无数据,69.08㎡,南,钢混结构,其他,,有,医院：白云区医院、沙河人民医院、武警医院、三九脑科医院、南方医院、157医院、佳和医院小区内；配套有chao市、儿童娱乐设施、篮球场、休闲亭等。地下一层为大型室内车场供租用或选购交通：门口公交、近广州东站、天平架地铁口。,公交车站：豪景花园站、途经路线有B6B6快11路夜14路46路56路72路85路109路110路111路112路136路140路179路201路219路241路246路297路501路502沙田班车502路等等。多路公交地铁站：天平架3、6号线地铁口。
时代长岛 2室1厅 北,110,12061,南沙,2室1厅1卫,91.21㎡,平层,塔楼,高楼层(共29层),暂无数据,暂无,北,钢混结构,其他,,有,,
颐德湾尚 板楼两梯两户 南北对流   四房望园林安静,450,31713,南沙,4室2厅2卫,141.9㎡,平层,暂无数据,低楼层(共30层),暂无数据,暂无,南,钢混结构,其他,,有,,
怡安花园 2室1厅 西南,200,28990,海珠,2室1厅1卫,68.99㎡,平层,塔楼,高楼层(共9层),暂无数据,60.24㎡,西南,钢混结构,简装,,,,
好地段 户型实用 装修保养新 通风采光靓 东南北单边位,380,39436,海珠,4室3厅1卫,96.36㎡,平层,塔楼,高楼层(共18层),暂无数据,80.25㎡,东南北,钢混结构,精装,,有,商场：好又多市、家乐福市医院：海珠区人民医院、东升医院银行：工商银行、农业银行、建设银行、光大银行饮食：嘉华美食、云香快餐娱乐：晓港公园、国广场,公交车：基立村站、途经线路：285、14、25、29、82、86、87、88、180、186、190、192、222、253、544、823、夜16、夜20、夜30、夜32和夜33地铁：地铁2号线江南西站
北京路低层方正两房 楼下有院 框架结构,220,37301,越秀,2室1厅1卫,58.98㎡,平层,塔楼,低楼层(共8层),暂无数据,暂无,南,钢混结构,简装,,,成熟商圈天字码头江边、新大新、天河城、北京路步行街、中华广场。越秀区长堤医院广医一院中山二院省中医省人民医院邮局：中国邮政银行：工商银行、农业银行、中国银行、建设银行、,步行街珠江边户型方正格局合理通风好越秀南客运站公园省医院中山一医院、6号线北京路地铁A出口公交站光路珠公交站珠光路菜市场近天字码头有水吧多条路线去往各区
保利天际南向三房、高交付标准、中间楼层、业主诚心出,280,22286,增城,3室2厅2卫,125.64㎡,平层,塔楼,中楼层(共53层),暂无数据,暂无,南,钢混结构,其他,,有,小区楼下有新世界大型的商圈、步行即可到达大润发商场、汇太广场、耀莱电影院、海底捞大型连锁、省水电医院、华兴市场、还有新塘地铁站、和轻轨高铁站、银行：工商银行、民生银行、邮政银行、建设银行,
利汇名悦大厦 4室2厅 南,1498,78005,天河,4室2厅2卫,192.04㎡,平层,塔楼,高楼层(共32层),暂无数据,148.36㎡,南,钢混结构,精装,,有,,
南北对流 南向一线江景 视野开阔 采光好,1658,64597,番禺,4室2厅4卫,256.67㎡,错层,板楼,中楼层(共29层),暂无数据,暂无,南北,钢混结构,精装,,有,,距华南快速沙溪出入口1KM、距新光快速沙溪出入口2KM、距地铁3号线夏滘站2KM、5站到达珠江新城
听涛雅苑 方正三房 次顶楼 东西对流采光好 90%实用率,268,33136,海珠,3室2厅1卫,80.88㎡,平层,塔楼,高楼层(共9层),暂无数据,73.5㎡,东西,钢混结构,其他,,,,距离地铁八号线鹭江站步行600米、小区门口就是公交车中大北门站：8、11、24、121、131、182、229、247、266等公交线路经过、出行很便利
美林湖畔 南北对流大三房 户型方正,588,55990,天河,3室2厅2卫,105.02㎡,平层,塔楼,低楼层(共18层),暂无数据,85.89㎡,北,钢混结构,其他,,有,小区旁有杨桃公园、方便您休闲的娱乐。美林天地商城是该小区的一个主要配套、里面有宜家、九毛九、山㟂会员店、居然之家等品牌入驻、给您生活带来更多的便利小区门口有底商、旁边是石溪菜市场、生活便利。,小区南面688米是5号线三溪地铁站、北面500米是杨桃公园公交总站、有B19、218、53、503路公交车、开车走黄埔大道和中山大道都方便（数据来源于高德地图）
绿湖5期方正小三房、家具家电齐全、业主自住保养好,78.8,8764,增城,3室2厅1卫,89.92㎡,平层,塔楼,低楼层(共33层),暂无数据,暂无,东北,钢混结构,其他,,,,
户型方正、大房大厅、通风采光好、视野开阔、安静不吵,600,46975,荔湾,3室2厅2卫,127.73㎡,平层,塔楼,中楼层(共33层),暂无数据,103.53㎡,东北,钢混结构,精装,,有,双地铁+两大桥+三隧道立体交通体系：连接项目的地铁口为滘口站、该站为广州地铁五号线的始发站、该线路为贯通广州东西的大动脉、与全部地铁线路均有交汇站、除此之外、滘口还是佛山五号线和广州五号线的交汇站、让您畅达广佛两地！,三地铁、双大桥及三隧道的立体交通体系、出行便利。地铁：广州5号线、广州1号线延长线及佛山5号线。公交路线：19、55、57、广81、193、75、236、207、277、280、309、312、783、夜11、夜29等。
富丽广场 两房一厅 中层朝东 光线好 配套齐 可公积金,130,17688,番禺,2室1厅1卫,73.5㎡,平层,板塔结合,中楼层(共6层),暂无数据,暂无,东,钢混结构,简装,,,大石城、东联步行街、大石家私城、信和、仓隆购物广场、人人乐等多个大型。医院：大石镇人民医院、武警医院,公交：17路、13路、53、186、181路、209路、217路、236路、25路地铁：3号线大石站
福泰园 刚需上车之房、房子视野开阔、采光好配套齐全,110,19928,番禺,2室1厅1卫,55.2㎡,平层,塔楼,高楼层(共7层),暂无数据,暂无,南北,钢混结构,简装,,,工商银行、建设银行、中国邮政银行、中国银行、广发银行、农商银行；好又多、天汇、世纪华联；洒店：香江酒店、长隆酒店、城市便捷酒店、长广酒店,富丽公交站：51路、304路、番182路、番187路、番188路等多路公交线路、公交地铁接驳线7路、地铁3号线
科慧单间、近地铁口、中高楼层、出行方便,60,15061,增城,1室1厅1卫,39.84㎡,平层,塔楼,高楼层(共34层),暂无数据,暂无,南,钢混结构,其他,,有,离朱村农贸批发市场路程3公里、小区有完善底商、理发店、药店、各个地区特色美食饭店。双达广场、苏元达广场、增城达广场。医院有朱村医院、省妇幼医院,小区门口200米、就是地铁21号线--快站凤岗地铁站、也是朱村板块唯一的快线站。21号地铁线由天河员村出发至增城广场总长61公里
保利越秀岭南林语 2室1厅 北,160,21114,黄埔,2室1厅1卫,75.78㎡,平层,塔楼,中楼层(共32层),暂无数据,暂无,北,钢混结构,精装,,有,,
省级东川 电梯 西南北大三房  户型方正,512,59014,越秀,3室1厅1卫,86.76㎡,平层,塔楼,高楼层(共9层),暂无数据,暂无,东,钢混结构,其他,,有,中山大学附属医院、广药附一医院、广东省人民医院等；商场：中华广场、等；公园：东山湖公园、烈士陵园等；银行：邮政银行、工商银行、建设银行、民生银行等,楼盘50米有公交车站、距离烈士林园一号地铁站（高德地图显示）200米。出行交通便利
公园前9号小区 3室2厅 南,83,10165,花都,3室2厅1卫,81.66㎡,平层,板楼,中楼层(共7层),暂无数据,暂无,南,钢混结构,精装,,,,
此房 满五年唯一 南北对流 安静花园 无遮挡 交通方便,270,40835,海珠,2室2厅1卫,66.12㎡,平层,塔楼,中楼层(共16层),暂无数据,51.55㎡,南,钢混结构,其他,,有,生活配套：金碧三市场、宏华市场、7-11、OK便利店。医院：石溪医院、中山二院南院、恒大社区健康医疗。邮局：鸣翠邮局、南石头邮局。银行：中行、建行、农行、工行、兴业、招行、邮政、平安银行等,：公交：9、13、59、75、79、86、87、180、202、221、230、288、309、546、551、夜7、夜20、夜24(金碧花园站)。地铁：小区门口距离广佛线石溪站190米左右
江泰地铁隔壁花园小区、坐南朝北、视野开阔能望小蛮腰,310,38931,海珠,2室1厅1卫,79.63㎡,平层,塔楼,高楼层(共18层),暂无数据,暂无,西北,钢混结构,精装,,有,距离小区50米有江泰地铁2号线11号环城线、科派、润政广场、燕汇广场、燕子岗运动场、距离小区800米左右有多家三甲医院、、各种生活配套都很完善,
佳润上品次新房、精装一房  配套齐全 交通便利,220,45092,天河,1室1厅1卫,48.79㎡,平层,塔楼,高楼层(共9层),暂无数据,38.51㎡,西,钢混结构,其他,,有,旁边就是杨桃公园风景美丽商场乐都汇商场天银广场远洋明苑幼儿园酒店医院银行民生银行广发银行交通银行建设银行交通BRT公交站地铁出行方便美林天地购物,佳润上品菁园位于天河中山大道BRT黄村站、南侧前往天河黄埔比较方便经过线路B1B2B4B5B17等、地铁4号线车陂站、13号线珠村站、5号线三溪地铁站。
华景新城公安宿舍 近地铁站 电梯2房 安静舒适,370,44498,天河,2室2厅1卫,83.15㎡,平层,塔楼,中楼层(共9层),暂无数据,75.2㎡,南,钢混结构,精装,,有,,门口有公交车站、去地铁口200米、人车分流、停车场在小区外围
天马丽苑二期 1室1厅 南,55,13077,花都,1室1厅1卫,42.06㎡,平层,塔楼,高楼层(共34层),暂无数据,31.6㎡,南,钢混结构,精装,,有,,
品秀星图 大阳台 视野开阔无遮挡单边位、近泳池花园,265,23789,增城,3室1厅2卫,111.4㎡,平层,塔楼,高楼层(共24层),暂无数据,90.92㎡,南,钢混结构,精装,,有,综合商场：凯达尔、奥园康威广场、腕达广场、永旺梦乐城、腕禾购物广场医院：南方医院新塘分院（三甲）、增城区医院（三甲）银行：中国建设银行、中国工商银行、中国农业银行、中国银行小区内部配套：幼儿园、图书馆、街、儿童游乐场、游泳池、会所,地铁13号线官湖地铁站、16/23号线（规划）；广汕铁路、广深铁路、穗莞深城轨等；京港澳高速、广源快速路、G107国道、荔新公路、济广高速房主自荐(业主对房源的描述)
此房满五年 厅直出阳台 安静 采光充足 小区环境好,100,18840,白云,2室1厅1卫,53.08㎡,平层,塔楼,低楼层(共6层),暂无数据,暂无,西南,钢混结构,其他,,,,凰岗总站：17路280路夜2路夜3路521路126路476路总站、交通便捷
南沙保利城 2室2厅 西北,79,11802,南沙,2室2厅1卫,66.94㎡,平层,塔楼,高楼层(共28层),暂无数据,55.47㎡,西北,钢混结构,精装,,有,,
琶洲西 客村地铁口 珠影大院低层 南北对流,350,63086,海珠,3室1厅1卫,55.48㎡,平层,板楼,低楼层(共6层),暂无数据,50.14㎡,南,混合结构,其他,,,沃尔玛(客村店)、宏城chao市、赤岗路蔬菜市场、南方购物、新港购物医疗：广东省第二人民医院、海军医院、海军421医院、中山医学院附属二门诊、岭南口腔专科医院、海员医院。,双地铁：3号线、8号线客村站。公交：69路、184路、190路、226路、130路、20路、14路、189路、206路、252路、264A路、37。
御花园 南向精装三房 中楼层 户型方正,136,13912,花都,3室2厅1卫,97.76㎡,平层,板塔结合,中楼层(共28层),暂无数据,暂无,南,钢混结构,精装,,有,医疗：广州花都区第二人民医院、广州花都狮诚中西医结合医院、广州花都狮岭合益门诊部购物：狮岭.海纳皮具饰博园、合成市场、香港街、苏宁易购（狮岭直营店）、盛世市场（祥丰南路）雅乐城广场、东福购物广场（合成北路）、融创茂仅10分车程。,小区有楼巴直通马鞍山地铁口、小区门口300米处有公交站牌、花62路、花81路、花25路、花715路还有狮岭直达广州桂花岗的大巴等、狮岭大道东距离广清高速出口仅1.3公里、交通出行便利多选择
此房满五、一手业主自住、视野没遮挡、生活配套完善。,435,54560,海珠,2室2厅1卫,79.73㎡,平层,塔楼,低楼层(共18层),暂无数据,暂无,东北,钢混结构,其他,,有,：商场：凯德乐峰广场200米、7-ELEVEN320米等；医疗：海珠区红十字会医院700米、南方医科大学珠江医院1100米、广州医科大学附属第二医院2000米；银行：中国银行、广州银行、平安银行、建设银行酒店：7天、商务酒店,公交：榕景路133米、沙园站176米、凤凰新村（宝业路口）320米、沙渡路387米地铁：沙园211米（广佛与8号线汇集）、凤凰新村953米房主自荐(业主对房源的描述)
南北对流的四房户型  简易化装修 暖色系 通透性很好,655,34802,花都,4室2厅2卫,188.21㎡,平层,塔楼,高楼层(共26层),暂无数据,157.38㎡,南,钢混结构,精装,,有,,
电梯平层 全明屋 精装两房 全明屋 业主诚意出,210,29716,海珠,2室1厅1卫,70.67㎡,平层,塔楼,高楼层(共9层),暂无数据,63.36㎡,南,钢混结构,其他,,有,商场：好又多市、家乐福市医院：海珠区中医院、红十字会医院、东升医院银行：工商银行、农业银行、建设银行、光大银行饮食：嘉华美食、云香快餐娱乐：晓港公园、国广场、,公交车：基立村站、途经线路：285、14、25、29、82、86、87、88、180、186、190、192、222、253、544、823、夜16、夜20、夜30、夜32和夜33地铁：地铁2号线江南西站和2号线市二宫站
天马丽苑二期 3室2厅 西,150,13042,花都,3室2厅1卫,115.02㎡,平层,塔楼,中楼层(共33层),暂无数据,暂无,西,钢混结构,简装,,有,,
番禺汉溪板块越秀和越府 精装新房 无抵押,750,56836,番禺,4室2厅2卫,131.96㎡,平层,塔楼,高楼层(共32层),暂无数据,106.85㎡,南北,钢混结构,精装,,有,,地铁/城轨：3条地铁线、7号线、18号线交汇【南村博】站距离项目约500米、未来4站到冼村站；7号线、3号线交汇【汉溪长隆】站距离项目约1公里、无缝接驳2、4号线、轻松通达广州各主城区；另外佛莞城轨【长隆站】距离项目约1.8公里、快速接驳佛山东莞、
客村地铁口上盖原装电梯珠影大院丽影广场精装南向三房,420,46667,海珠,3室2厅2卫,90㎡,平层,塔楼,中楼层(共9层),暂无数据,暂无,东南南,钢混结构,精装,,有,购物：丽影广场、沃尔玛(客村店)、赤岗路蔬菜市场、南方购物、新港购物/电影院啥都有。医疗：广东省第二人民医院、海军医院、海军421医院、中山医学院附属二门诊、岭南口腔专科医院、海员医院。,交通路线：双地铁：3号线、8号线客村站。公交：69路、184路、190路、226路、130路、20路、14路、189路、206路、252路、264A路、37路等
祈福都会花园 精装三房 望花园 通风采光好,105,11510,花都,3室2厅2卫,91.23㎡,平层,塔楼,中楼层(共11层),暂无数据,暂无,北,钢混结构,其他,,有,福都会花园位于花山平步大道与106国道交界近融创文旅城方便进入停机坪已开通轻轨站花山站交通便利,
原装电梯、楼龄新、南向户型、配套成熟、诚心卖,750,78069,越秀,3室1厅1卫,96.07㎡,平层,塔楼,中楼层(共31层),暂无数据,74.87㎡,南,钢混结构,其他,,有,综合商场：小区门口家有福、钱大妈银行:工商银行、交通银行、中国银行、建设银行、农业银行医院:中山一院、广东省人民医院、广东药学院附属医院。市场：共和西菜市场、东园市场。,公交：54路、56路、62路、185路、189路、204路、261路、283路、284路、293路、305路、517路、518路、542路、550路地铁一、五号线杨箕站、13号线梅东路站。
金碧新城 高层大两房 户型方正 采光好,210,28075,白云,2室1厅1卫,74.8㎡,平层,塔楼,高楼层(共27层),暂无数据,暂无,东北,钢混结构,精装,,有,有月亮弯游泳池、罗马音乐喷泉、环型跑道、蓝球场、网球场、会所、市场、银行、好又多、啃德基、国美电器、便利店、麦当劳、美宜家、7-11便利店、石井广场、社区医疗门诊等,金碧新城公交路线金碧新城总站:7路车63路车小坪南站:259、539、8号线地铁小坪站G出口。途经石井站线路126、254、280、291B425、519、524、556、563、308、318、41乡村巴士1乡村巴士2夜26
滨海新城 二期大阳台对流五房 户型方正实用 诚心放卖,243,16994,南沙,5室2厅2卫,143㎡,平层,塔楼,中楼层(共33层),暂无数据,暂无,南,钢混结构,精装,,有,小区生活配套浓郁、今州广场、华汇广场、奥园金莎广场、奥园中环广场、金洲农贸市场、南沙城商圈、蕉门公园、南沙三甲医院等。,小区门口有两个公交车站、4个站左右可以到地铁四号线金洲地铁站、可到广州市区、南沙客运港方向、多个共享单车停放点。
六运小区 电梯中层大3房 南北对流 单边位 生活方便,420,50996,天河,3室1厅1卫,82.36㎡,平层,塔楼,中楼层(共8层),暂无数据,暂无,南北,钢混结构,其他,,有,商场：天河城天环广场购书广场维多利广场正佳广场花城广场饮食：麦当劳真功夫72街等等银行：农业银行建设银行工商银行交通银行,
锦尚蓬莱南向三房、朝花园安静、证满五年、看房方便,188,19838,花都,3室2厅1卫,94.77㎡,平层,塔楼,低楼层(共18层),暂无数据,78.19㎡,南,钢混结构,精装,,有,,
满五不唯一、高层靓向、光线充足、视野开阔,1300,102710,天河,3室2厅2卫,126.57㎡,平层,塔楼,中楼层(共33层),暂无数据,100.79㎡,南,钢混结构,其他,,有,,天河新作位于太古汇北边、交通有三号线地铁石牌桥站、一号线体育站、BRT石牌桥站
此房过五年唯一 小区环境优美 低层 安静舒适 交通方便,253,31945,番禺,3室2厅1卫,79.2㎡,平层,塔楼,低楼层(共7层),暂无数据,暂无,西,钢混结构,其他,,,,交通便利；公交129路、53路、146路、769路、番17、番13、79路、125路、211路、301路、308路、522路、562路、822路、地铁接驳4号、地铁接驳5号等地铁2号3号线等
花都颐和山庄、全新开发商原装三房、次新楼。架格笋,52,4812,花都,3室2厅2卫,108.08㎡,平层,塔楼,低楼层(共18层),暂无数据,87.35㎡,南,钢混结构,简装,,有,小区内设有会所餐厅、便利店商场、泳池、山顶公园颐天阁等配套设施、10分.钟到梯面农贸市场、9公.里到红山村油菜花观赏地、15分.钟到花山两龙市场、30分.钟到花都融创文旅城、5公.里到花山镇医院、15公.里花都中西医结合医院,3公里到肇花高速、乐广高速出入口、8公里机场城轨花山站、接驳机场和广州地铁3号线、小区楼巴、四条公交线、立体便捷交通网
